"","NGenes","PropDown","PropUp","Direction","PValue","FDR","differential_genes_gene_id","differential_genes_gene_name"
"GO_UDP_GLYCOSYLTRANSFERASE_ACTIVITY",113,0.336283185840708,0.150442477876106,"Down",0.039,0.140509842519685,"ENSMUSG00000006731, ENSMUSG00000028541, ENSMUSG00000079445, ENSMUSG00000090145, ENSMUSG00000056124, ENSMUSG00000032854, ENSMUSG00000043300, ENSMUSG00000052423, ENSMUSG00000034040, ENSMUSG00000074004, ENSMUSG00000058152, ENSMUSG00000060988, ENSMUSG00000026156, ENSMUSG00000022367, ENSMUSG00000034780, ENSMUSG00000096914, ENSMUSG00000032997, ENSMUSG00000030657, ENSMUSG00000041372, ENSMUSG00000042428, ENSMUSG00000055629, ENSMUSG00000039774, ENSMUSG00000024064, ENSMUSG00000036155, ENSMUSG00000043857, ENSMUSG00000027963, ENSMUSG00000025158, ENSMUSG00000026994, ENSMUSG00000045994, ENSMUSG00000074569, ENSMUSG00000022686, ENSMUSG00000033849, ENSMUSG00000074892","B4galnt1, B4galt2, B3gnt7, Ugt1a6b, B4galt6, Ugt8a, B3galnt1, B4galt3, Wbscr17, B3gnt6, Chsy3, Galnt13, B3gat2, Has2, B3galt1, Galntl6, Chpf, Xylt1, B4galnt3, Mgat3, B4galnt4, Galnt12, Galnt14, Mgat5, Mgat5b, Extl2, Rfng, Galnt3, B3gat1, Gcnt7, B3gnt5, B3galt2, B3galt5"
"GO_CYSTEINE_TYPE_ENDOPEPTIDASE_ACTIVITY",76,0.157894736842105,0.276315789473684,"Up",0.039,0.140509842519685,"ENSMUSG00000029640, ENSMUSG00000020124, ENSMUSG00000028776, ENSMUSG00000027997, ENSMUSG00000027248, ENSMUSG00000025887, ENSMUSG00000025076, ENSMUSG00000028560, ENSMUSG00000024889, ENSMUSG00000003161, ENSMUSG00000024910, ENSMUSG00000032688","Usp12, Usp15, Tinagl1, Casp6, Pdia3, Casp12, Casp7, Usp1, Rce1, Sri, Ctsw, Malt1"
"GO_G_PROTEIN_COUPLED_AMINE_RECEPTOR_ACTIVITY",43,0.395348837209302,0.0232558139534884,"Down",0.04,0.141376447876448,"ENSMUSG00000053004, ENSMUSG00000027335, ENSMUSG00000008590, ENSMUSG00000028747, ENSMUSG00000049295, ENSMUSG00000039059, ENSMUSG00000045318, ENSMUSG00000032259, ENSMUSG00000049511, ENSMUSG00000045875, ENSMUSG00000034987, ENSMUSG00000050541, ENSMUSG00000035283, ENSMUSG00000031489, ENSMUSG00000050783, ENSMUSG00000039106","Hrh1, Adra1d, Htr3b, Htr6, Zfp219, Hrh3, Adra2c, Drd2, Htr1b, Adra1a, Hrh2, Adra1b, Adrb1, Adrb3, Htr1f, Htr5a"
"GO_CELL_ADHESION_MOLECULE_BINDING",172,0.244186046511628,0.319767441860465,"Up",0.04,0.141376447876448,"ENSMUSG00000025510, ENSMUSG00000021501, ENSMUSG00000015647, ENSMUSG00000062960, ENSMUSG00000029086, ENSMUSG00000020310, ENSMUSG00000037815, ENSMUSG00000044860, ENSMUSG00000079465, ENSMUSG00000031207, ENSMUSG00000028249, ENSMUSG00000033278, ENSMUSG00000017344, ENSMUSG00000019820, ENSMUSG00000025809, ENSMUSG00000040488, ENSMUSG00000038264, ENSMUSG00000000157, ENSMUSG00000021823, ENSMUSG00000040511, ENSMUSG00000006932, ENSMUSG00000043631, ENSMUSG00000009687, ENSMUSG00000054808, ENSMUSG00000054693, ENSMUSG00000021814, ENSMUSG00000021186, ENSMUSG00000001930, ENSMUSG00000015143, ENSMUSG00000027009, ENSMUSG00000001029, ENSMUSG00000061665, ENSMUSG00000039813, ENSMUSG00000026193, ENSMUSG00000042379, ENSMUSG00000024539","Cd151, Caml, Lama5, Kdr, Prom1, Madcam1, Ctnna1, Gm1123, Col4a3, Msn, Sdcbp, Ptprm, Vtn, Utrn, Itgb1, Ltbp4, Sema7a, Itgb2l, Vcl, Pvr, Ctnnb1, Ecm2, Fxyd5, Actn4, Adam10, Anxa7, Fbln5, Vwf, Actn1, Itga4, Icam2, Cd2ap, Tbc1d2, Fn1, Esm1, Ptpn2"
"GO_PROTEASOME_BINDING",16,0.125,0.25,"Up",0.04,0.141376447876448,"ENSMUSG00000042165","Gm9774"
"GO_TRANSCRIPTION_FACTOR_ACTIVITY_PROTEIN_BINDING",547,0.148080438756856,0.230347349177331,"Up",0.04,0.141376447876448,"ENSMUSG00000029655, ENSMUSG00000028800, ENSMUSG00000037935, ENSMUSG00000021109, ENSMUSG00000021690, ENSMUSG00000027671, ENSMUSG00000031379, ENSMUSG00000010047, ENSMUSG00000025423, ENSMUSG00000031586, ENSMUSG00000035873, ENSMUSG00000027803, ENSMUSG00000024431, ENSMUSG00000002108, ENSMUSG00000015143, ENSMUSG00000035958, ENSMUSG00000036376, ENSMUSG00000031965, ENSMUSG00000034205, ENSMUSG00000020167, ENSMUSG00000026751, ENSMUSG00000050567, ENSMUSG00000001134, ENSMUSG00000025958, ENSMUSG00000027206, ENSMUSG00000050919, ENSMUSG00000042918, ENSMUSG00000071646, ENSMUSG00000022475, ENSMUSG00000002250, ENSMUSG00000048490, ENSMUSG00000038722, ENSMUSG00000052763, ENSMUSG00000039697, ENSMUSG00000071359, ENSMUSG00000033249, ENSMUSG00000019947, ENSMUSG00000025066, ENSMUSG00000022634, ENSMUSG00000002679, ENSMUSG00000040289, ENSMUSG00000037235, ENSMUSG00000006715, ENSMUSG00000030059, ENSMUSG00000056537, ENSMUSG00000062327, ENSMUSG00000030180, ENSMUSG00000008976, ENSMUSG00000026946, ENSMUSG00000028259, ENSMUSG00000030557, ENSMUSG00000053110, ENSMUSG00000037896, ENSMUSG00000030782, ENSMUSG00000055197, ENSMUSG00000032053, ENSMUSG00000042557, ENSMUSG00000008305, ENSMUSG00000009569, ENSMUSG00000033543, ENSMUSG00000044167, ENSMUSG00000028647, ENSMUSG00000015619, ENSMUSG00000022205, ENSMUSG00000036459, ENSMUSG00000026571, ENSMUSG00000032698, ENSMUSG00000072872, ENSMUSG00000029265, ENSMUSG00000059436, ENSMUSG00000019303, ENSMUSG00000000581, ENSMUSG00000022361, ENSMUSG00000041238, ENSMUSG00000026436, ENSMUSG00000050029, ENSMUSG00000021598, ENSMUSG00000028191, ENSMUSG00000054808, ENSMUSG00000056234, ENSMUSG00000051316, ENSMUSG00000008398, ENSMUSG00000032715, ENSMUSG00000025902, ENSMUSG00000025025, ENSMUSG00000006932","N4bp2l2, Hdac1, Smarce1, Hif1a, Jmy, Actl6a, Pir, Hyal2, Pias2, Rbpms, Pawr, Wwtr1, Nr3c1, Nr1h3, Actn1, Tdp2, Abt1, Tbx20, Loxl2, Tcf3, Nr5a1, Maml1, Uxt, Creb1, Cops2, Zfp366, Mamstr, Mta2, Hdac7, Ppard, Nrip1, Bud31, Zfp212, Ncoa7, Tbpl1, Hsf4, Arid5b, Sfr1, Yaf2, Med6, Hey1, Mxd4, Gmnn, Tmf1, Rlim, T, Kdm5a, Gabpa, Nmi, Fhl5, Mef2a, Yap1, Rcor1, Tgfb1i1, Fev, Pou2af1, Sin3a, Tle1, Mkl2, Gtf2a2, Foxo1, Mycbp, Gata3, Sub1, Wtip, Dcaf6, Lmo2, Rybp, Dr1, Max, Psmc3ip, C1d, Zhx1, Rbbp8, Elk4, Rap2c, Med10, Bcl10, Actn4, Ncoa4, Taf7, Elk3, Trib3, Sox17, Mxi1, Ctnnb1"
"GO_TRANSCRIPTION_COACTIVATOR_ACTIVITY",282,0.145390070921986,0.226950354609929,"Up",0.04,0.141376447876448,"ENSMUSG00000026751, ENSMUSG00000020167, ENSMUSG00000028647, ENSMUSG00000031965, ENSMUSG00000036376, ENSMUSG00000033543, ENSMUSG00000009569, ENSMUSG00000032053, ENSMUSG00000015143, ENSMUSG00000030782, ENSMUSG00000002108, ENSMUSG00000053110, ENSMUSG00000030557, ENSMUSG00000028259, ENSMUSG00000027803, ENSMUSG00000031586, ENSMUSG00000025423, ENSMUSG00000010047, ENSMUSG00000027671, ENSMUSG00000021690, ENSMUSG00000037935, ENSMUSG00000008976, ENSMUSG00000030180, ENSMUSG00000006932, ENSMUSG00000025902, ENSMUSG00000051316, ENSMUSG00000056234, ENSMUSG00000054808, ENSMUSG00000028191, ENSMUSG00000002679, ENSMUSG00000022634, ENSMUSG00000025066, ENSMUSG00000019947, ENSMUSG00000050029, ENSMUSG00000071359, ENSMUSG00000039697, ENSMUSG00000038722, ENSMUSG00000048490, ENSMUSG00000002250, ENSMUSG00000019303, ENSMUSG00000059436, ENSMUSG00000026571, ENSMUSG00000015619, ENSMUSG00000022205, ENSMUSG00000050567","Nr5a1, Tcf3, Mycbp, Tbx20, Abt1, Gtf2a2, Mkl2, Pou2af1, Actn1, Tgfb1i1, Nr1h3, Yap1, Mef2a, Fhl5, Wwtr1, Rbpms, Pias2, Hyal2, Actl6a, Jmy, Smarce1, Gabpa, Kdm5a, Ctnnb1, Sox17, Taf7, Ncoa4, Actn4, Bcl10, Med6, Yaf2, Sfr1, Arid5b, Rap2c, Tbpl1, Ncoa7, Bud31, Nrip1, Ppard, Psmc3ip, Max, Dcaf6, Gata3, Sub1, Maml1"
"GO_PHOSPHATIDYLCHOLINE_BINDING",19,0.210526315789474,0.315789473684211,"Up",0.041,0.144398076923077,"ENSMUSG00000032083, ENSMUSG00000021171, ENSMUSG00000032080, ENSMUSG00000042272","Apoa1, Esyt2, Apoa4, Sestd1"
"GO_RNA_POLYMERASE_I_ACTIVITY",12,0.0833333333333333,0.333333333333333,"Up",0.042,0.146833969465649,"ENSMUSG00000029642, ENSMUSG00000045996, ENSMUSG00000020561","Polr1d, Polr2k, Twistnb"
"GO_DNA_DIRECTED_DNA_POLYMERASE_ACTIVITY",26,0.0769230769230769,0.269230769230769,"Up",0.042,0.146833969465649,"ENSMUSG00000068391, ENSMUSG00000020974, ENSMUSG00000021668, ENSMUSG00000030042","Chrac1, Pole2, Polk, Pole4"
"GO_PHOSPHATASE_ACTIVATOR_ACTIVITY",8,0,0.375,"Up",0.043,0.148110902255639,"ENSMUSG00000066043, ENSMUSG00000020427","Phactr4, Igfbp3"
"GO_COLLAGEN_BINDING",60,0.183333333333333,0.3,"Up",0.043,0.148110902255639,"ENSMUSG00000020077, ENSMUSG00000025809, ENSMUSG00000043631, ENSMUSG00000021388, ENSMUSG00000032383, ENSMUSG00000005397, ENSMUSG00000021806, ENSMUSG00000022371, ENSMUSG00000001930, ENSMUSG00000070436, ENSMUSG00000042284, ENSMUSG00000026193","Srgn, Itgb1, Ecm2, Aspn, Ppib, Nid1, Nid2, Col14a1, Vwf, Serpinh1, Itga1, Fn1"
"GO_NAD_DEPENDENT_PROTEIN_DEACETYLASE_ACTIVITY",17,0.294117647058824,0.176470588235294,"Down",0.043,0.148110902255639,"ENSMUSG00000008855, ENSMUSG00000034245, ENSMUSG00000031161, ENSMUSG00000025486, ENSMUSG00000004698","Hdac5, Hdac11, Hdac6, Sirt3, Hdac9"
"GO_PHOSPHATIDYLINOSITOL_PHOSPHATE_BINDING",111,0.171171171171171,0.261261261261261,"Up",0.043,0.148110902255639,"ENSMUSG00000020590, ENSMUSG00000051355, ENSMUSG00000041685, ENSMUSG00000030536, ENSMUSG00000026175, ENSMUSG00000038696, ENSMUSG00000018001, ENSMUSG00000018417, ENSMUSG00000041695, ENSMUSG00000021669, ENSMUSG00000074513, ENSMUSG00000022200, ENSMUSG00000066621, ENSMUSG00000019804, ENSMUSG00000032231, ENSMUSG00000026883, ENSMUSG00000046519, ENSMUSG00000009545, ENSMUSG00000042272, ENSMUSG00000037712, ENSMUSG00000038844, ENSMUSG00000032041, ENSMUSG00000020189","Snx13, Commd1, Fcho2, Iqgap1, Vil1, Mapkap1, Cyth3, Myo1b, Kcnj2, Col4a3bp, Arfip1, Golph3, Tecpr1, Snx3, Anxa2, Dab2ip, Golph3l, Kcnq1, Sestd1, Fermt2, Kif16b, Tirap, Osbpl8"
"GO_CARBON_NITROGEN_LIGASE_ACTIVITY_WITH_GLUTAMINE_AS_AMIDO_N_DONOR",10,0.4,0.1,"Down",0.044,0.149905204460967,"ENSMUSG00000034171, ENSMUSG00000020899, ENSMUSG00000025991, ENSMUSG00000029536","Faah, Pfas, Cps1, Gatc"
"GO_PHOSPHATIDYLINOSITOL_MONOPHOSPHATE_PHOSPHATASE_ACTIVITY",13,0.153846153846154,0.307692307692308,"Up",0.044,0.149905204460967,"ENSMUSG00000031337, ENSMUSG00000025240, ENSMUSG00000021987","Mtm1, Sacm1l, Mtmr6"
"GO_METAL_CLUSTER_BINDING",59,0.101694915254237,0.271186440677966,"Up",0.044,0.149905204460967,"ENSMUSG00000032051, ENSMUSG00000028165, ENSMUSG00000031068, ENSMUSG00000044792, ENSMUSG00000027809, ENSMUSG00000031781","Fdx1, Cisd2, Glrx3, Isca1, Etfdh, Ciapin1"
"GO_DIPEPTIDYL_PEPTIDASE_ACTIVITY",13,0.230769230769231,0.230769230769231,"Up",0.045,0.152783333333333,"ENSMUSG00000043943, ENSMUSG00000061119, ENSMUSG00000035000","Naalad2, Prcp, Dpp4"
"GO_GLUTAMATE_RECEPTOR_BINDING",35,0.457142857142857,0.0857142857142857,"Down",0.046,0.153948214285714,"ENSMUSG00000074736, ENSMUSG00000000881, ENSMUSG00000026959, ENSMUSG00000019146, ENSMUSG00000030854, ENSMUSG00000038738, ENSMUSG00000052572, ENSMUSG00000037541, ENSMUSG00000032259, ENSMUSG00000061981, ENSMUSG00000020886, ENSMUSG00000050321, ENSMUSG00000036902, ENSMUSG00000032356, ENSMUSG00000024617, ENSMUSG00000025813","Syndig1, Dlg3, Grin1, Cacng2, Ptpn5, Shank1, Dlg2, Shank2, Drd2, Flot2, Dlg4, Neto1, Neto2, Rasgrf1, Camk2a, Homer2"
"GO_DIVALENT_INORGANIC_CATION_TRANSMEMBRANE_TRANSPORTER_ACTIVITY",161,0.385093167701863,0.130434782608696,"Down",0.046,0.153948214285714,"ENSMUSG00000022094, ENSMUSG00000063873, ENSMUSG00000072572, ENSMUSG00000022416, ENSMUSG00000020882, ENSMUSG00000039878, ENSMUSG00000029868, ENSMUSG00000034591, ENSMUSG00000030592, ENSMUSG00000062661, ENSMUSG00000043029, ENSMUSG00000021991, ENSMUSG00000024112, ENSMUSG00000031517, ENSMUSG00000019146, ENSMUSG00000057914, ENSMUSG00000025318, ENSMUSG00000003352, ENSMUSG00000040118, ENSMUSG00000004113, ENSMUSG00000026407, ENSMUSG00000041771, ENSMUSG00000047037, ENSMUSG00000031142, ENSMUSG00000052372, ENSMUSG00000059003, ENSMUSG00000030523, ENSMUSG00000030376, ENSMUSG00000039579, ENSMUSG00000021313, ENSMUSG00000022315, ENSMUSG00000032839, ENSMUSG00000020723, ENSMUSG00000051331, ENSMUSG00000031376, ENSMUSG00000052387, ENSMUSG00000046634, ENSMUSG00000024270, ENSMUSG00000029151, ENSMUSG00000026959, ENSMUSG00000017412, ENSMUSG00000031453, ENSMUSG00000020411, ENSMUSG00000015968, ENSMUSG00000020866, ENSMUSG00000026463, ENSMUSG00000010066, ENSMUSG00000036949, ENSMUSG00000069806, ENSMUSG00000040373, ENSMUSG00000037996, ENSMUSG00000041710, ENSMUSG00000009292, ENSMUSG00000053395, ENSMUSG00000079055, ENSMUSG00000054640, ENSMUSG00000030302, ENSMUSG00000041460","Slc39a14, Slc24a3, Slc39a2, Cacna1i, Cacnb1, Slc39a5, Trpv6, Slc41a2, Ryr1, Ncs1, Trpv3, Cacna2d3, Cacna1h, Gpm6a, Cacng2, Cacnb2, Jph3, Cacnb3, Cacna2d1, Cacna1b, Cacna1s, Slc24a4, Nipa1, Cacna1f, Il1rapl1, Grin2a, Trpm1, Slc8a2, Grin3a, Ryr2, Slc30a8, Trpc1, Cacng4, Cacna1c, Atp2b3, Trpm3, Pkd1l1, Slc39a6, Slc30a3, Grin1, Cacnb4, Rasa3, Nipal4, Cacna1d, Cacna1g, Atp2b4, Cacna2d2, Slc39a12, Cacng7, Cacng5, Slc24a2, Trpc5, Trpm2, Cacng8, Slc8a3, Slc8a1, Atp2b2, Cacna2d4"
"GO_PHOSPHATE_ION_BINDING",11,0.181818181818182,0.272727272727273,"Up",0.046,0.153948214285714,"ENSMUSG00000078650, ENSMUSG00000015961","G6pc, Adss"
"GO_VOLTAGE_GATED_ION_CHANNEL_ACTIVITY",180,0.494444444444444,0.133333333333333,"Down",0.047,0.153948214285714,"ENSMUSG00000003352, ENSMUSG00000050556, ENSMUSG00000040896, ENSMUSG00000035355, ENSMUSG00000040118, ENSMUSG00000062785, ENSMUSG00000016346, ENSMUSG00000028931, ENSMUSG00000026407, ENSMUSG00000053519, ENSMUSG00000004113, ENSMUSG00000031142, ENSMUSG00000064329, ENSMUSG00000037624, ENSMUSG00000052372, ENSMUSG00000028051, ENSMUSG00000059742, ENSMUSG00000058975, ENSMUSG00000021730, ENSMUSG00000051497, ENSMUSG00000034402, ENSMUSG00000035580, ENSMUSG00000045246, ENSMUSG00000022416, ENSMUSG00000060882, ENSMUSG00000020882, ENSMUSG00000018470, ENSMUSG00000058740, ENSMUSG00000024957, ENSMUSG00000001901, ENSMUSG00000023033, ENSMUSG00000031576, ENSMUSG00000047959, ENSMUSG00000000197, ENSMUSG00000062661, ENSMUSG00000030592, ENSMUSG00000021991, ENSMUSG00000024112, ENSMUSG00000032511, ENSMUSG00000025221, ENSMUSG00000019146, ENSMUSG00000029862, ENSMUSG00000040724, ENSMUSG00000057914, ENSMUSG00000050138, ENSMUSG00000047976, ENSMUSG00000020866, ENSMUSG00000049265, ENSMUSG00000010066, ENSMUSG00000079056, ENSMUSG00000044216, ENSMUSG00000019194, ENSMUSG00000069806, ENSMUSG00000096146, ENSMUSG00000040373, ENSMUSG00000035681, ENSMUSG00000022843, ENSMUSG00000053395, ENSMUSG00000043301, ENSMUSG00000041460, ENSMUSG00000026824, ENSMUSG00000038026, ENSMUSG00000020723, ENSMUSG00000051331, ENSMUSG00000057182, ENSMUSG00000056258, ENSMUSG00000027895, ENSMUSG00000044708, ENSMUSG00000063142, ENSMUSG00000033998, ENSMUSG00000038319, ENSMUSG00000009731, ENSMUSG00000033854, ENSMUSG00000042604, ENSMUSG00000029016, ENSMUSG00000026959, ENSMUSG00000037579, ENSMUSG00000017412, ENSMUSG00000070304, ENSMUSG00000045404, ENSMUSG00000051726, ENSMUSG00000015968","Cacnb3, Kcnb1, Kcnd3, Kcnh4, Cacna2d1, Kcnc3, Kcnq2, Kcnab2, Cacna1s, Kcnip1, Cacna1b, Cacna1f, Scn1a, Kcnk2, Il1rapl1, Hcn3, Kcnh7, Kcnc1, Hcn1, Kcnj16, Kcnh5, Kcnh8, Kcng4, Cacna1i, Kcnd2, Cacnb1, Kcnab3, Kcnt1, Kcnk4, Kcnh6, Scn8a, Kcnu1, Kcna3, Nalcn, Ncs1, Ryr1, Cacna2d3, Cacna1h, Scn5a, Kcnip2, Cacng2, Clcn1, Kcna2, Cacnb2, Kcnk12, Kcna1, Cacna1g, Kcnk3, Cacna2d2, Kcnip3, Kcnj4, Scn1b, Cacng7, Kcnj11, Cacng5, Kcnc2, Clcn2, Cacng8, Kcnj6, Cacna2d4, Kcnj3, Kcnj9, Cacng4, Cacna1c, Scn3a, Kcnq3, Kcnc4, Kcnj10, Kcnma1, Kcnk1, Kcnh2, Kcnd1, Kcnk10, Kcna4, Clcn6, Grin1, Kcnh3, Cacnb4, Scn2b, Kcnk13, Kcnf1, Cacna1d"
"GO_IONOTROPIC_GLUTAMATE_RECEPTOR_BINDING",23,0.434782608695652,0.0869565217391304,"Down",0.047,0.153948214285714,"ENSMUSG00000000881, ENSMUSG00000038738, ENSMUSG00000019146, ENSMUSG00000052572, ENSMUSG00000061981, ENSMUSG00000032259, ENSMUSG00000037541, ENSMUSG00000020886, ENSMUSG00000050321, ENSMUSG00000036902","Dlg3, Shank1, Cacng2, Dlg2, Flot2, Drd2, Shank2, Dlg4, Neto1, Neto2"
"GO_HISTONE_DEACETYLASE_ACTIVITY_H3_K14_SPECIFIC_",12,0.416666666666667,0.166666666666667,"Down",0.047,0.153948214285714,"ENSMUSG00000004698, ENSMUSG00000008855, ENSMUSG00000034245, ENSMUSG00000025486, ENSMUSG00000031161","Hdac9, Hdac5, Hdac11, Sirt3, Hdac6"
"GO_PASSIVE_TRANSMEMBRANE_TRANSPORTER_ACTIVITY",429,0.412587412587413,0.144522144522145,"Down",0.047,0.153948214285714,"ENSMUSG00000031343, ENSMUSG00000029212, ENSMUSG00000022843, ENSMUSG00000030428, ENSMUSG00000027577, ENSMUSG00000037996, ENSMUSG00000051359, ENSMUSG00000055026, ENSMUSG00000025892, ENSMUSG00000028020, ENSMUSG00000074968, ENSMUSG00000020866, ENSMUSG00000049265, ENSMUSG00000029054, ENSMUSG00000000794, ENSMUSG00000045404, ENSMUSG00000051726, ENSMUSG00000035594, ENSMUSG00000002908, ENSMUSG00000037579, ENSMUSG00000041078, ENSMUSG00000031453, ENSMUSG00000017412, ENSMUSG00000070304, ENSMUSG00000042604, ENSMUSG00000020524, ENSMUSG00000003378, ENSMUSG00000033981, ENSMUSG00000001985, ENSMUSG00000052387, ENSMUSG00000046634, ENSMUSG00000002771, ENSMUSG00000056258, ENSMUSG00000032839, ENSMUSG00000020723, ENSMUSG00000001986, ENSMUSG00000026251, ENSMUSG00000021730, ENSMUSG00000021313, ENSMUSG00000059336, ENSMUSG00000059742, ENSMUSG00000046959, ENSMUSG00000054934, ENSMUSG00000030523, ENSMUSG00000058441, ENSMUSG00000028583, ENSMUSG00000041771, ENSMUSG00000031142, ENSMUSG00000059003, ENSMUSG00000036570, ENSMUSG00000004113, ENSMUSG00000053519, ENSMUSG00000026407, ENSMUSG00000034863, ENSMUSG00000020886, ENSMUSG00000040724, ENSMUSG00000057914, ENSMUSG00000050138, ENSMUSG00000030525, ENSMUSG00000025318, ENSMUSG00000047976, ENSMUSG00000019146, ENSMUSG00000025221, ENSMUSG00000021991, ENSMUSG00000024112, ENSMUSG00000031517, ENSMUSG00000029868, ENSMUSG00000062661, ENSMUSG00000001260, ENSMUSG00000008590, ENSMUSG00000099041, ENSMUSG00000063873, ENSMUSG00000056073, ENSMUSG00000036196, ENSMUSG00000041460, ENSMUSG00000043301, ENSMUSG00000054477, ENSMUSG00000027071, ENSMUSG00000000881, ENSMUSG00000041710, ENSMUSG00000009292, ENSMUSG00000053395, ENSMUSG00000096146, ENSMUSG00000040373, ENSMUSG00000023259, ENSMUSG00000035681, ENSMUSG00000036578, ENSMUSG00000034145, ENSMUSG00000044216, ENSMUSG00000019194, ENSMUSG00000069806, ENSMUSG00000010066, ENSMUSG00000079056, ENSMUSG00000029015, ENSMUSG00000029468, ENSMUSG00000013495, ENSMUSG00000015968, ENSMUSG00000026959, ENSMUSG00000020734, ENSMUSG00000033854, ENSMUSG00000029016, ENSMUSG00000030209, ENSMUSG00000009731, ENSMUSG00000000560, ENSMUSG00000032017, ENSMUSG00000063142, ENSMUSG00000033998, ENSMUSG00000038319, ENSMUSG00000027895, ENSMUSG00000044708, ENSMUSG00000057182, ENSMUSG00000038026, ENSMUSG00000026824, ENSMUSG00000051331, ENSMUSG00000058975, ENSMUSG00000028051, ENSMUSG00000022935, ENSMUSG00000039579, ENSMUSG00000052372, ENSMUSG00000037624, ENSMUSG00000064329, ENSMUSG00000001225, ENSMUSG00000016346, ENSMUSG00000028931, ENSMUSG00000040118, ENSMUSG00000031791, ENSMUSG00000062785, ENSMUSG00000029211, ENSMUSG00000040896, ENSMUSG00000035355, ENSMUSG00000003352, ENSMUSG00000022758, ENSMUSG00000050556, ENSMUSG00000032511, ENSMUSG00000059412, ENSMUSG00000029862, ENSMUSG00000023033, ENSMUSG00000001901, ENSMUSG00000031576, ENSMUSG00000047959, ENSMUSG00000030592, ENSMUSG00000033676, ENSMUSG00000000197, ENSMUSG00000047797, ENSMUSG00000043029, ENSMUSG00000024957, ENSMUSG00000071424, ENSMUSG00000058740, ENSMUSG00000060882, ENSMUSG00000022416, ENSMUSG00000020882, ENSMUSG00000018470, ENSMUSG00000035580, ENSMUSG00000045246, ENSMUSG00000027950, ENSMUSG00000070570, ENSMUSG00000034402, ENSMUSG00000051497","Gabra3, Gabrb1, Clcn2, Ttyh1, Chrna4, Slc24a2, Ncald, Gabrg3, Gria4, Glrb, Ano3, Cacna1g, Kcnk3, Gabrd, Kcnn3, Kcnk13, Kcnf1, Chrna5, Kcnn1, Kcnh3, Grid1, Rasa3, Cacnb4, Scn2b, Kcna4, Gria1, Grik5, Gria2, Grik3, Trpm3, Pkd1l1, Grin2d, Kcnq3, Trpc1, Cacng4, Gria3, Chrnd, Hcn1, Ryr2, Slc14a1, Kcnh7, Slc26a1, Kcnmb4, Trpm1, Panx2, Pdpn, Slc24a4, Cacna1f, Grin2a, Fxyd1, Cacna1b, Kcnip1, Cacna1s, Ano8, Dlg4, Kcna2, Cacnb2, Kcnk12, Chrna7, Jph3, Kcna1, Cacng2, Kcnip2, Cacna2d3, Cacna1h, Gpm6a, Trpv6, Ncs1, Gabrg1, Htr3b, Gm28035, Slc24a3, Grik2, Slc26a8, Cacna2d4, Kcnj6, Kcnn2, P2rx3, Dlg3, Trpc5, Trpm2, Cacng8, Kcnj11, Cacng5, Slc26a6, Kcnc2, Fxyd7, Tmem63c, Kcnj4, Scn1b, Cacng7, Cacna2d2, Kcnip3, Slc26a5, P2rx7, Tmem175, Cacna1d, Grin1, Grin2c, Kcnk10, Clcn6, Grin2b, Kcnd1, Gabra2, Grik4, Kcnma1, Kcnk1, Kcnh2, Kcnc4, Kcnj10, Scn3a, Kcnj9, Kcnj3, Cacna1c, Kcnc1, Hcn3, Grik1, Grin3a, Il1rapl1, Kcnk2, Scn1a, Slc26a3, Kcnq2, Kcnab2, Cacna2d1, Tmem38a, Kcnc3, Gabra4, Kcnd3, Kcnh4, Cacnb3, P2rx6, Kcnb1, Scn5a, Fxyd2, Clcn1, Scn8a, Kcnh6, Kcnu1, Kcna3, Ryr1, Gabrb3, Nalcn, Gjb1, Trpv3, Kcnk4, Grid2, Kcnt1, Kcnd2, Cacna1i, Cacnb1, Kcnab3, Kcnh8, Kcng4, Chrnb2, Slc17a7, Kcnh5, Kcnj16"
"GO_INORGANIC_ANION_TRANSMEMBRANE_TRANSPORTER_ACTIVITY",121,0.363636363636364,0.148760330578512,"Down",0.047,0.153948214285714,"ENSMUSG00000037344, ENSMUSG00000029862, ENSMUSG00000033676, ENSMUSG00000001260, ENSMUSG00000006469, ENSMUSG00000070570, ENSMUSG00000017740, ENSMUSG00000022265, ENSMUSG00000046959, ENSMUSG00000001225, ENSMUSG00000036570, ENSMUSG00000029211, ENSMUSG00000034863, ENSMUSG00000023032, ENSMUSG00000029016, ENSMUSG00000000560, ENSMUSG00000061742, ENSMUSG00000096764, ENSMUSG00000026904, ENSMUSG00000060961, ENSMUSG00000036196, ENSMUSG00000006576, ENSMUSG00000031343, ENSMUSG00000029212, ENSMUSG00000022843, ENSMUSG00000030428, ENSMUSG00000027202, ENSMUSG00000023259, ENSMUSG00000055026, ENSMUSG00000032122, ENSMUSG00000028020, ENSMUSG00000029015, ENSMUSG00000029054, ENSMUSG00000074968","Slc12a9, Clcn1, Gabrb3, Gabrg1, Slc34a3, Slc17a7, Slc12a5, Ank, Slc26a1, Slc26a3, Fxyd1, Gabra4, Ano8, Slc4a8, Clcn6, Gabra2, Slc22a12, Gm21985, Slc4a10, Slc4a4, Slc26a8, Slc4a3, Gabra3, Gabrb1, Clcn2, Ttyh1, Slc12a1, Slc26a6, Gabrg3, Slc37a2, Glrb, Slc26a5, Gabrd, Ano3"
"GO_OXIDOREDUCTASE_ACTIVITY_ACTING_ON_NAD_P_H",82,0.0365853658536585,0.317073170731707,"Up",0.047,0.153948214285714,"ENSMUSG00000022450, ENSMUSG00000020844, ENSMUSG00000046949, ENSMUSG00000026456, ENSMUSG00000032872, ENSMUSG00000002416, ENSMUSG00000021764, ENSMUSG00000022210, ENSMUSG00000016427, ENSMUSG00000030562","Ndufa6, Nxn, Nqo2, Cyb5r1, Cyb5r4, Ndufb2, Ndufs4, Dhrs4, Ndufa1, Nox4"
"GO_ACTIVATING_TRANSCRIPTION_FACTOR_BINDING",57,0.087719298245614,0.280701754385965,"Up",0.047,0.153948214285714,"ENSMUSG00000018604, ENSMUSG00000032698, ENSMUSG00000006932, ENSMUSG00000030557, ENSMUSG00000064215, ENSMUSG00000042557, ENSMUSG00000031965, ENSMUSG00000022475, ENSMUSG00000028800, ENSMUSG00000024563, ENSMUSG00000062327, ENSMUSG00000025958","Tbx3, Lmo2, Ctnnb1, Mef2a, Ifi27, Sin3a, Tbx20, Hdac7, Hdac1, Smad2, T, Creb1"
"GO_ALPHA_TUBULIN_BINDING",23,0.260869565217391,0.0869565217391304,"Down",0.048,0.156699288256228,"ENSMUSG00000031161, ENSMUSG00000026426, ENSMUSG00000037196, ENSMUSG00000029167, ENSMUSG00000051359, ENSMUSG00000034891","Hdac6, Arl8a, Pacrg, Ppargc1a, Ncald, Sncb"
"GO_POTASSIUM_ION_TRANSMEMBRANE_TRANSPORTER_ACTIVITY",138,0.5,0.159420289855072,"Down",0.049,0.158308098591549,"ENSMUSG00000063873, ENSMUSG00000045246, ENSMUSG00000035580, ENSMUSG00000034402, ENSMUSG00000051497, ENSMUSG00000024957, ENSMUSG00000058740, ENSMUSG00000018470, ENSMUSG00000040907, ENSMUSG00000060882, ENSMUSG00000001901, ENSMUSG00000031576, ENSMUSG00000047959, ENSMUSG00000037344, ENSMUSG00000047976, ENSMUSG00000039463, ENSMUSG00000040724, ENSMUSG00000050138, ENSMUSG00000059412, ENSMUSG00000025221, ENSMUSG00000040896, ENSMUSG00000035355, ENSMUSG00000050556, ENSMUSG00000016346, ENSMUSG00000053519, ENSMUSG00000028931, ENSMUSG00000062785, ENSMUSG00000031791, ENSMUSG00000028051, ENSMUSG00000041771, ENSMUSG00000037624, ENSMUSG00000017740, ENSMUSG00000021730, ENSMUSG00000059742, ENSMUSG00000037341, ENSMUSG00000054934, ENSMUSG00000058975, ENSMUSG00000056258, ENSMUSG00000041329, ENSMUSG00000038026, ENSMUSG00000026824, ENSMUSG00000096764, ENSMUSG00000005553, ENSMUSG00000063142, ENSMUSG00000033998, ENSMUSG00000038319, ENSMUSG00000044708, ENSMUSG00000027895, ENSMUSG00000042604, ENSMUSG00000033854, ENSMUSG00000009731, ENSMUSG00000051726, ENSMUSG00000045404, ENSMUSG00000002908, ENSMUSG00000037579, ENSMUSG00000079056, ENSMUSG00000013495, ENSMUSG00000000794, ENSMUSG00000049265, ENSMUSG00000035681, ENSMUSG00000096146, ENSMUSG00000044216, ENSMUSG00000037996, ENSMUSG00000043301, ENSMUSG00000054477","Slc24a3, Kcng4, Kcnh8, Kcnh5, Kcnj16, Kcnk4, Kcnt1, Kcnab3, Atp1a3, Kcnd2, Kcnh6, Kcnu1, Kcna3, Slc12a9, Kcna1, Slc9a8, Kcna2, Kcnk12, Fxyd2, Kcnip2, Kcnd3, Kcnh4, Kcnb1, Kcnq2, Kcnip1, Kcnab2, Kcnc3, Tmem38a, Hcn3, Slc24a4, Kcnk2, Slc12a5, Hcn1, Kcnh7, Slc9a7, Kcnmb4, Kcnc1, Kcnq3, Atp1b2, Kcnj9, Kcnj3, Gm21985, Atp4a, Kcnma1, Kcnk1, Kcnh2, Kcnj10, Kcnc4, Kcna4, Kcnk10, Kcnd1, Kcnf1, Kcnk13, Kcnn1, Kcnh3, Kcnip3, Tmem175, Kcnn3, Kcnk3, Kcnc2, Kcnj11, Kcnj4, Slc24a2, Kcnj6, Kcnn2"
"GO_ANKYRIN_BINDING",20,0.5,0.1,"Down",0.049,0.158308098591549,"ENSMUSG00000032511, ENSMUSG00000011751, ENSMUSG00000020598, ENSMUSG00000030549, ENSMUSG00000054640, ENSMUSG00000021061, ENSMUSG00000016346, ENSMUSG00000096146, ENSMUSG00000015968, ENSMUSG00000104445","Scn5a, Sptbn4, Nrcam, Rhcg, Slc8a1, Sptb, Kcnq2, Kcnj11, Cacna1d, Rhbg"
"GO_BITTER_TASTE_RECEPTOR_ACTIVITY",15,0,0.0666666666666667,"Up",0.049,0.158308098591549,"ENSMUSG00000056203","Tas2r135"
"GO_O_ACYLTRANSFERASE_ACTIVITY",45,0.222222222222222,0.177777777777778,"Down",0.05,0.161005263157895,"ENSMUSG00000030747, ENSMUSG00000035596, ENSMUSG00000041653, ENSMUSG00000007783, ENSMUSG00000034254","Dgat2, Mboat7, Pnpla3, Cpt1c, Agpat1"
"GO_SYNTAXIN_1_BINDING",18,0.444444444444444,0.0555555555555556,"Down",0.051,0.162546875,"ENSMUSG00000027457, ENSMUSG00000033615, ENSMUSG00000034799, ENSMUSG00000027273, ENSMUSG00000020894, ENSMUSG00000022340, ENSMUSG00000004626, ENSMUSG00000025867","Snph, Cplx1, Unc13a, Snap25, Vamp2, Sybu, Stxbp2, Cplx2"
"GO_LONG_CHAIN_FATTY_ACID_BINDING",12,0.166666666666667,0.333333333333333,"Up",0.051,0.162546875,"ENSMUSG00000049929, ENSMUSG00000041488, ENSMUSG00000026175, ENSMUSG00000002250","Lpar4, Stx3, Vil1, Ppard"
"GO_FIBROBLAST_GROWTH_FACTOR_RECEPTOR_BINDING",28,0.285714285714286,0.0357142857142857,"Down",0.051,0.162546875,"ENSMUSG00000000182, ENSMUSG00000051379, ENSMUSG00000025551, ENSMUSG00000022523, ENSMUSG00000036585, ENSMUSG00000047787","Fgf23, Flrt3, Fgf14, Fgf12, Fgf1, Flrt1"
