"","NGenes","PropDown","PropUp","Direction","PValue","FDR","differential_genes_gene_id","differential_genes_gene_name"
"GO_CYTOSKELETAL_PROTEIN_BINDING",769,0.261378413524057,0.182054616384915,"Down",0.521,0.687326923076923,"ENSMUSG00000020483, ENSMUSG00000030739, ENSMUSG00000028354, ENSMUSG00000004187, ENSMUSG00000015766, ENSMUSG00000027581, ENSMUSG00000069601, ENSMUSG00000002985, ENSMUSG00000069662, ENSMUSG00000038244, ENSMUSG00000003411, ENSMUSG00000063646, ENSMUSG00000039953, ENSMUSG00000028773, ENSMUSG00000029060, ENSMUSG00000020396, ENSMUSG00000021573, ENSMUSG00000034891, ENSMUSG00000045288, ENSMUSG00000051331, ENSMUSG00000029121, ENSMUSG00000047945, ENSMUSG00000017390, ENSMUSG00000027223, ENSMUSG00000032826, ENSMUSG00000063146, ENSMUSG00000031285, ENSMUSG00000027525, ENSMUSG00000053093, ENSMUSG00000090799, ENSMUSG00000028524, ENSMUSG00000006457, ENSMUSG00000052698, ENSMUSG00000038775, ENSMUSG00000027238, ENSMUSG00000024502, ENSMUSG00000024376, ENSMUSG00000024501, ENSMUSG00000015222, ENSMUSG00000020639, ENSMUSG00000031137, ENSMUSG00000028834, ENSMUSG00000027488, ENSMUSG00000044700, ENSMUSG00000030987, ENSMUSG00000026494, ENSMUSG00000029168, ENSMUSG00000032827, ENSMUSG00000029095, ENSMUSG00000030549, ENSMUSG00000020067, ENSMUSG00000018411, ENSMUSG00000044433, ENSMUSG00000022619, ENSMUSG00000022048, ENSMUSG00000056367, ENSMUSG00000041205, ENSMUSG00000054728, ENSMUSG00000030000, ENSMUSG00000027257, ENSMUSG00000037032, ENSMUSG00000021373, ENSMUSG00000033392, ENSMUSG00000022340, ENSMUSG00000024862, ENSMUSG00000027254, ENSMUSG00000019831, ENSMUSG00000025429, ENSMUSG00000040860, ENSMUSG00000079243, ENSMUSG00000038816, ENSMUSG00000005980, ENSMUSG00000003452, ENSMUSG00000020135, ENSMUSG00000026204, ENSMUSG00000026933, ENSMUSG00000024533, ENSMUSG00000038013, ENSMUSG00000040276, ENSMUSG00000032598, ENSMUSG00000024277, ENSMUSG00000013921, ENSMUSG00000022054, ENSMUSG00000031840, ENSMUSG00000021057, ENSMUSG00000039057, ENSMUSG00000031161, ENSMUSG00000024163, ENSMUSG00000025909, ENSMUSG00000096146, ENSMUSG00000029094, ENSMUSG00000028758, ENSMUSG00000019261, ENSMUSG00000057897, ENSMUSG00000020598, ENSMUSG00000029015, ENSMUSG00000028434, ENSMUSG00000020061, ENSMUSG00000029104, ENSMUSG00000067889, ENSMUSG00000014602, ENSMUSG00000023439, ENSMUSG00000054477, ENSMUSG00000067276, ENSMUSG00000063142, ENSMUSG00000026426, ENSMUSG00000086040, ENSMUSG00000001025, ENSMUSG00000021097, ENSMUSG00000024423, ENSMUSG00000015968, ENSMUSG00000028572, ENSMUSG00000026879, ENSMUSG00000034616, ENSMUSG00000033590, ENSMUSG00000033208, ENSMUSG00000068876, ENSMUSG00000034295, ENSMUSG00000027805, ENSMUSG00000016346, ENSMUSG00000018126, ENSMUSG00000063077, ENSMUSG00000041642, ENSMUSG00000037217, ENSMUSG00000035390, ENSMUSG00000032186, ENSMUSG00000010021, ENSMUSG00000041298, ENSMUSG00000025478, ENSMUSG00000063063, ENSMUSG00000018697, ENSMUSG00000049493, ENSMUSG00000028785, ENSMUSG00000032118, ENSMUSG00000034958, ENSMUSG00000068206, ENSMUSG00000031543, ENSMUSG00000010154, ENSMUSG00000032511, ENSMUSG00000026764, ENSMUSG00000031202, ENSMUSG00000104445, ENSMUSG00000033763, ENSMUSG00000029167, ENSMUSG00000029636, ENSMUSG00000024044, ENSMUSG00000026131, ENSMUSG00000011751, ENSMUSG00000022044, ENSMUSG00000032549, ENSMUSG00000054640, ENSMUSG00000024511, ENSMUSG00000051359, ENSMUSG00000074657, ENSMUSG00000074652, ENSMUSG00000003810, ENSMUSG00000027624, ENSMUSG00000078485, ENSMUSG00000037196, ENSMUSG00000011148, ENSMUSG00000056856, ENSMUSG00000021700, ENSMUSG00000026270, ENSMUSG00000055805, ENSMUSG00000049122, ENSMUSG00000021061, ENSMUSG00000038756, ENSMUSG00000020668, ENSMUSG00000020447, ENSMUSG00000044042, ENSMUSG00000029166, ENSMUSG00000033585, ENSMUSG00000020894, ENSMUSG00000025401, ENSMUSG00000051675, ENSMUSG00000066196, ENSMUSG00000035121, ENSMUSG00000057914, ENSMUSG00000022629, ENSMUSG00000028307, ENSMUSG00000034593","Dynll2, Myh14, Fmn2, Kifc2, Eps8, Stmn3, Ank3, Apoe, Marcks, Mical2, Rab3b, Jakmip1, Clstn1, Fabp3, Mib2, Nefh, Tppp, Sncb, Ush1g, Cacna1c, Crmp1, Marcksl1, Aldoc, Mapk8ip1, Ank2, Clip2, Dcx, Phactr3, Myh7, Klhl33, Sgip1, Actn3, Tln2, Vill, Frmd5, Jakmip2, Epb41l4a, Dpysl3, Map2, Pfn4, Fgf13, Trim63, Snta1, Tmem201, Stim1, Kif26b, Dpysl5, Ppp1r9a, Ablim2, Rhcg, Mypn, Mapt, Camsap3, Mapk8ip2, Dpysl2, Actr3b, Map6d1, Phactr1, Add2, Pacsin3, Apbb1, Cap2, Clasp2, Sybu, Klc2, Map1a, Wasf1, Pstpip2, Crocc, Xirp1, Ctnnal1, Dnase1, Bicd1, Apc2, Ptprn, Camsap1, Spire1, Wipf2, Pacsin1, Nckipsd, Mapre2, Clip3, Nefm, Rab3a, Akap5, Myo16, Hdac6, Mapk8ip3, Sntg1, Kcnj11, Afap1, Kif17, Map1s, Camk2b, Nrcam, Slc26a5, Epb41l4b, Mybpc1, Htt, Sptbn2, Kif1a, Gnb3, Kcnn2, Capn6, Kcnma1, Arl8a, Wipf3, S100a6, Clmn, Impact, Cacna1d, Hook1, Gsn, Ssh3, Myo5c, S100b, Cgn, Fhod3, Pfn2, Kcnq2, Baiap2l2, Kif1b, Kif21b, Syn1, Brsk1, Tmod2, Kif19a, Katnal1, Dpysl4, Ctnna2, Aatf, Pls1, Hpca, Fez1, Atcay, Pick1, Ank1, Spire2, Scn5a, Kif5c, Rab39b, Rhbg, Mtss1l, Ppargc1a, Wasf3, Epb41l3, Dst, Sptbn4, Stmn4, Rab6b, Slc8a1, Rab27b, Ncald, Kif5a, Myh7b, Mast2, Epb41l1, Plekhn1, Pacrg, Adssl1, Jakmip3, Rab3c, Capn10, Fmnl1, Frmd3, Sptb, Ttll6, Kif3c, Npc1l1, Fmn1, Mapre3, Ndn, Vamp2, Myo1a, Trim32, Spag8, Neil2, Cacnb2, Kif21a, Aldob, Myo5a"
"GO_AMINO_ACID_BINDING",101,0.247524752475248,0.207920792079208,"Down",0.524,0.688346808510638,"ENSMUSG00000032725, ENSMUSG00000028020, ENSMUSG00000047261, ENSMUSG00000069662, ENSMUSG00000039579, ENSMUSG00000015702, ENSMUSG00000030731, ENSMUSG00000025991, ENSMUSG00000005360, ENSMUSG00000027347, ENSMUSG00000020829, ENSMUSG00000022212, ENSMUSG00000006764, ENSMUSG00000026620, ENSMUSG00000022304, ENSMUSG00000026959, ENSMUSG00000037606, ENSMUSG00000031960, ENSMUSG00000024827, ENSMUSG00000030209, ENSMUSG00000010660, ENSMUSG00000024261","Folr2, Glrb, Gap43, Marcks, Grin3a, Anxa9, Syt3, Cps1, Slc1a3, Rasgrp1, Slc46a1, Cpne6, Tph2, Mark1, Dpys, Grin1, Osbpl5, Aars, Gldc, Grin2b, Plcd1, Syt4"
"GO_MRNA_3_UTR_BINDING",47,0.234042553191489,0.148936170212766,"Down",0.524,0.688346808510638,"ENSMUSG00000028546, ENSMUSG00000025586, ENSMUSG00000039652, ENSMUSG00000023495, ENSMUSG00000000552, ENSMUSG00000037331, ENSMUSG00000038132, ENSMUSG00000007670","Elavl4, Cpeb1, Cpeb3, Pcbp4, Zfp385a, Larp1, Rbm24, Khsrp"
"GO_KINASE_ACTIVATOR_ACTIVITY",58,0.224137931034483,0.155172413793103,"Down",0.524,0.688346808510638,"ENSMUSG00000031760, ENSMUSG00000022619, ENSMUSG00000031137, ENSMUSG00000041014, ENSMUSG00000040687, ENSMUSG00000048895, ENSMUSG00000049489, ENSMUSG00000008734, ENSMUSG00000090071, ENSMUSG00000062991, ENSMUSG00000020541, ENSMUSG00000018166, ENSMUSG00000022488","Mt3, Mapk8ip2, Fgf13, Nrg3, Madd, Cdk5r1, Fam58b, Gprc5b, Cdk5r2, Nrg1, Tom1l1, Erbb3, Nckap1l"
"GO_STEROID_DEHYDROGENASE_ACTIVITY",24,0.125,0.0833333333333333,"Down",0.527,0.691310906515581,"ENSMUSG00000016194, ENSMUSG00000026675, ENSMUSG00000061758","Hsd11b1, Hsd17b7, Akr1b10"
"GO_RIBONUCLEOTIDE_BINDING",1717,0.199767035527082,0.20442632498544,"Up",0.529,0.692955445544555,"ENSMUSG00000018417, ENSMUSG00000029247, ENSMUSG00000002233, ENSMUSG00000044147, ENSMUSG00000067713, ENSMUSG00000021279, ENSMUSG00000028945, ENSMUSG00000026896, ENSMUSG00000046768, ENSMUSG00000027931, ENSMUSG00000024151, ENSMUSG00000018340, ENSMUSG00000021428, ENSMUSG00000020826, ENSMUSG00000074793, ENSMUSG00000020390, ENSMUSG00000054435, ENSMUSG00000019779, ENSMUSG00000034751, ENSMUSG00000020357, ENSMUSG00000035948, ENSMUSG00000030660, ENSMUSG00000029802, ENSMUSG00000042348, ENSMUSG00000052681, ENSMUSG00000021701, ENSMUSG00000024867, ENSMUSG00000031789, ENSMUSG00000037159, ENSMUSG00000030247, ENSMUSG00000024727, ENSMUSG00000019917, ENSMUSG00000059552, ENSMUSG00000020149, ENSMUSG00000020694, ENSMUSG00000016308, ENSMUSG00000020794, ENSMUSG00000042167, ENSMUSG00000073563, ENSMUSG00000020361, ENSMUSG00000040584, ENSMUSG00000069539, ENSMUSG00000005534, ENSMUSG00000042010, ENSMUSG00000005481, ENSMUSG00000004591, ENSMUSG00000053289, ENSMUSG00000025580, ENSMUSG00000021294, ENSMUSG00000024576, ENSMUSG00000027079, ENSMUSG00000067336, ENSMUSG00000022610, ENSMUSG00000020015, ENSMUSG00000031015, ENSMUSG00000018581, ENSMUSG00000005533, ENSMUSG00000020076, ENSMUSG00000062960, ENSMUSG00000022836, ENSMUSG00000026836, ENSMUSG00000038844, ENSMUSG00000022229, ENSMUSG00000004788, ENSMUSG00000043535, ENSMUSG00000043505, ENSMUSG00000024948, ENSMUSG00000022781, ENSMUSG00000009907, ENSMUSG00000024070, ENSMUSG00000020857, ENSMUSG00000052539, ENSMUSG00000063410, ENSMUSG00000015961, ENSMUSG00000015023, ENSMUSG00000006445, ENSMUSG00000064262, ENSMUSG00000015357, ENSMUSG00000029012, ENSMUSG00000008730, ENSMUSG00000028479, ENSMUSG00000020700, ENSMUSG00000041650, ENSMUSG00000003119, ENSMUSG00000024042, ENSMUSG00000019942, ENSMUSG00000038387, ENSMUSG00000000276, ENSMUSG00000030110, ENSMUSG00000052997, ENSMUSG00000021635, ENSMUSG00000028277, ENSMUSG00000047867, ENSMUSG00000036813, ENSMUSG00000024404, ENSMUSG00000027774, ENSMUSG00000053965, ENSMUSG00000020580, ENSMUSG00000041997, ENSMUSG00000089687, ENSMUSG00000026341, ENSMUSG00000007739, ENSMUSG00000060733, ENSMUSG00000033191, ENSMUSG00000024789, ENSMUSG00000073639, ENSMUSG00000078578, ENSMUSG00000078365, ENSMUSG00000026277, ENSMUSG00000032220, ENSMUSG00000025357, ENSMUSG00000062949, ENSMUSG00000000127, ENSMUSG00000017418, ENSMUSG00000012519, ENSMUSG00000025915, ENSMUSG00000022329, ENSMUSG00000014932, ENSMUSG00000040675, ENSMUSG00000060904, ENSMUSG00000027935, ENSMUSG00000025060, ENSMUSG00000015656, ENSMUSG00000032849, ENSMUSG00000024759, ENSMUSG00000021959, ENSMUSG00000032562, ENSMUSG00000046808, ENSMUSG00000026785, ENSMUSG00000005102, ENSMUSG00000029298, ENSMUSG00000000359, ENSMUSG00000026117, ENSMUSG00000029710, ENSMUSG00000022220, ENSMUSG00000031309, ENSMUSG00000034761, ENSMUSG00000028719, ENSMUSG00000034731, ENSMUSG00000004771, ENSMUSG00000021108, ENSMUSG00000040296, ENSMUSG00000090019, ENSMUSG00000041297, ENSMUSG00000019794, ENSMUSG00000049892, ENSMUSG00000033885, ENSMUSG00000038855, ENSMUSG00000029923, ENSMUSG00000029148, ENSMUSG00000037514, ENSMUSG00000000001, ENSMUSG00000105504, ENSMUSG00000003228, ENSMUSG00000036093, ENSMUSG00000032715, ENSMUSG00000028126, ENSMUSG00000074364, ENSMUSG00000031016, ENSMUSG00000049871, ENSMUSG00000032547, ENSMUSG00000062232, ENSMUSG00000068039, ENSMUSG00000024290, ENSMUSG00000043931, ENSMUSG00000051747, ENSMUSG00000050029, ENSMUSG00000027177, ENSMUSG00000026034, ENSMUSG00000025358, ENSMUSG00000000530, ENSMUSG00000029169, ENSMUSG00000028410, ENSMUSG00000029735, ENSMUSG00000024234, ENSMUSG00000017686, ENSMUSG00000038145, ENSMUSG00000029128, ENSMUSG00000027579, ENSMUSG00000033542, ENSMUSG00000038774, ENSMUSG00000027108, ENSMUSG00000026775, ENSMUSG00000029648, ENSMUSG00000024079, ENSMUSG00000018425, ENSMUSG00000000486, ENSMUSG00000041845, ENSMUSG00000054404, ENSMUSG00000019944, ENSMUSG00000000787, ENSMUSG00000061838, ENSMUSG00000023460, ENSMUSG00000024892, ENSMUSG00000031377, ENSMUSG00000024054, ENSMUSG00000047446, ENSMUSG00000006386, ENSMUSG00000028978, ENSMUSG00000073775, ENSMUSG00000024242, ENSMUSG00000041187, ENSMUSG00000023852, ENSMUSG00000004451, ENSMUSG00000035305, ENSMUSG00000050697, ENSMUSG00000021408, ENSMUSG00000025324, ENSMUSG00000033792, ENSMUSG00000031701, ENSMUSG00000028125, ENSMUSG00000029521, ENSMUSG00000021149, ENSMUSG00000029363, ENSMUSG00000020900, ENSMUSG00000036241, ENSMUSG00000030249, ENSMUSG00000037921","Myo1b, Paics, Rhoc, Arf6, Prkag1, Cdc42bpb, Rheb, Ifih1, Rhoj, Npr1, Msh2, Anxa6, Riok1, Nos2, Hspa12b, Ube2b, Gimap4, Frk, Mast4, Flt4, Acss3, Pik3c2a, Abcg2, Arl15, Rap1b, Plk2, Pip5k1b, Cngb1, Wee2, Kcnj8, Trpm6, Sept10, Trp53, Rab1a, Tlk2, Ube2a, Ube2g1, Papd4, Csnk1g3, Hspa4, Abcb1a, Scyl2, Insr, Acacb, Ddx39, Pkn2, Ddx10, Eif4a3, Kif26a, Csnk1a1, Clp1, Bmpr2, Mapk12, Cdk17, Swap70, Dnah11, Igf1r, Ddx50, Kdr, Mylk, Acvr1, Kif16b, Atp12a, Eif2b2, Setx, Gimap5, Map4k2, Pak2, Vps4b, Prkd3, Nme2, Magi3, Stk24, Adss, Ddx19a, Epha2, Gimap8, Clpx, Orc5, Hipk1, Gne, Map3k3, Pcca, Cdk12, Sik1, Cdk1, Rras, Dgke, Ret, Uba2, Rad17, Ube2j1, Gimap6, Entpd8, Riok3, Gfm1, Pde5a, Rock2, Tlk1, Rab42, Actr3, Cct4, Ipmk, Tie1, Jak2, Rab18, Ube2d3, Mos, Stk25, Myo1e, Dgka, Atp11c, Fer, Arl5b, Mlkl, Sgk3, Stk3, Yes1, Mthfd1l, Arl1, Rab13, Slk, Hspa8, Abcc4, Atl3, Lats2, Gnai2, Atp10d, Pkn3, Eif2ak4, Gbp9, Rem1, Zap70, Ephb4, Adcy4, Rps6ka3, Map4k5, Cmpk1, Dgkh, Rab11a, Prkch, Ddx58, Gimap1, Cdk13, Katna1, Rasd1, Pxk, Itpkb, Rab19, Nrbp1, Pank2, Gnai3, Gbp5, Grk5, Arl5a, Trib3, Pip5k1a, Ehd2, Wee1, Nlrc3, Ryk, Rapgef2, Tcp1, Rock1, Gimap7, Ttn, Rap2c, Hipk3, Clk1, Cdk2, Acvrl1, Dhx15, Dnaja1, Tpk1, Mtpap, Rhot1, Snrk, Rab28, Srms, Arhgef5, Ascc3, Ola1, Yme1l1, Flt1, Eif2ak2, Dhx40, Sept1, Rhod, Slfn5, Rhobtb1, Ddx3x, Suclg2, Rab12, Pcx, Bmx, Smchd1, Arl4a, Tek, Nos3, Kti12, Map4k3, Prkd2, Chd1, Ralb, Ror1, Prkaa1, Ripk1, Atp10a, Atp7a, Dnaja2, Abca4, Chek2, Gtpbp4, Rfc5, Myh10, Ube2r2, Abcc9, Ddx60"
"GO_ORGANIC_ACID_BINDING",187,0.20855614973262,0.229946524064171,"Up",0.534,0.698523305084746,"ENSMUSG00000020826, ENSMUSG00000020405, ENSMUSG00000028978, ENSMUSG00000007039, ENSMUSG00000042272, ENSMUSG00000046814, ENSMUSG00000074643, ENSMUSG00000002250, ENSMUSG00000024892, ENSMUSG00000025747, ENSMUSG00000029522, ENSMUSG00000026175, ENSMUSG00000025333, ENSMUSG00000023057, ENSMUSG00000026335, ENSMUSG00000026580, ENSMUSG00000040710, ENSMUSG00000049929, ENSMUSG00000026582, ENSMUSG00000037936, ENSMUSG00000041650, ENSMUSG00000041685, ENSMUSG00000028003, ENSMUSG00000020189, ENSMUSG00000026943, ENSMUSG00000041936, ENSMUSG00000054474, ENSMUSG00000015656, ENSMUSG00000041488, ENSMUSG00000005534, ENSMUSG00000000889","Nos2, Fabp6, Nos3, Ddah2, Sestd1, Gchfr, Cpne1, Ppard, Pcx, Tyms, Pla2g1b, Vil1, Gpr143, Fabp2, Pam, Selp, St8sia4, Lpar4, Sele, Scarb1, Pcca, Fcho2, Lrat, Osbpl8, Lcn12, Agrn, Thnsl2, Hspa8, Stx3, Insr, Dbh"
"GO_TRANSFERASE_ACTIVITY_TRANSFERRING_ACYL_GROUPS",221,0.180995475113122,0.18552036199095,"Down",0.537,0.70104375,"ENSMUSG00000018909, ENSMUSG00000023832, ENSMUSG00000006378, ENSMUSG00000039470, ENSMUSG00000024426, ENSMUSG00000109523, ENSMUSG00000060166, ENSMUSG00000041220, ENSMUSG00000030747, ENSMUSG00000034265, ENSMUSG00000024764, ENSMUSG00000035285, ENSMUSG00000042506, ENSMUSG00000035596, ENSMUSG00000024084, ENSMUSG00000048142, ENSMUSG00000048483, ENSMUSG00000034254, ENSMUSG00000041653, ENSMUSG00000025153, ENSMUSG00000093930, ENSMUSG00000021364, ENSMUSG00000027603, ENSMUSG00000031169, ENSMUSG00000036304, ENSMUSG00000043461, ENSMUSG00000007783, ENSMUSG00000000340, ENSMUSG00000053877","Arrb1, Acat2, Gcat, Zdhhc2, Atat1, Gdf1, Zdhhc8, Elovl6, Dgat2, Zdhhc14, Naa40, Nat14, Usp22, Mboat7, Qpct, Nat8l, Zdhhc22, Agpat1, Pnpla3, Fasn, Hmgcs1, Elovl2, Ggt7, Porcn, Zdhhc23, Sptssb, Cpt1c, Dbt, Srcap"
"GO_SIGNALING_RECEPTOR_ACTIVITY",1104,0.214673913043478,0.146739130434783,"Down",0.54,0.70104375,"ENSMUSG00000024924, ENSMUSG00000033295, ENSMUSG00000043999, ENSMUSG00000049313, ENSMUSG00000044933, ENSMUSG00000028909, ENSMUSG00000036192, ENSMUSG00000056553, ENSMUSG00000035773, ENSMUSG00000040229, ENSMUSG00000032017, ENSMUSG00000019803, ENSMUSG00000024109, ENSMUSG00000027765, ENSMUSG00000000560, ENSMUSG00000027568, ENSMUSG00000062209, ENSMUSG00000028128, ENSMUSG00000031111, ENSMUSG00000039579, ENSMUSG00000025931, ENSMUSG00000024413, ENSMUSG00000030849, ENSMUSG00000069171, ENSMUSG00000030592, ENSMUSG00000052759, ENSMUSG00000029093, ENSMUSG00000039106, ENSMUSG00000047293, ENSMUSG00000049115, ENSMUSG00000049649, ENSMUSG00000070509, ENSMUSG00000022199, ENSMUSG00000031398, ENSMUSG00000029212, ENSMUSG00000045318, ENSMUSG00000025905, ENSMUSG00000043659, ENSMUSG00000031489, ENSMUSG00000068740, ENSMUSG00000021779, ENSMUSG00000031453, ENSMUSG00000003934, ENSMUSG00000066392, ENSMUSG00000034353, ENSMUSG00000031548, ENSMUSG00000029245, ENSMUSG00000058756, ENSMUSG00000059326, ENSMUSG00000049511, ENSMUSG00000044014, ENSMUSG00000052336, ENSMUSG00000056073, ENSMUSG00000038390, ENSMUSG00000008590, ENSMUSG00000032641, ENSMUSG00000070337, ENSMUSG00000025318, ENSMUSG00000090129, ENSMUSG00000025089, ENSMUSG00000011171, ENSMUSG00000046793, ENSMUSG00000079227, ENSMUSG00000032259, ENSMUSG00000049551, ENSMUSG00000038319, ENSMUSG00000020734, ENSMUSG00000020793, ENSMUSG00000035355, ENSMUSG00000050199, ENSMUSG00000049583, ENSMUSG00000019828, ENSMUSG00000068742, ENSMUSG00000023192, ENSMUSG00000023915, ENSMUSG00000064225, ENSMUSG00000034402, ENSMUSG00000049295, ENSMUSG00000015843, ENSMUSG00000024107, ENSMUSG00000071424, ENSMUSG00000028747, ENSMUSG00000068696, ENSMUSG00000059921, ENSMUSG00000018822, ENSMUSG00000033676, ENSMUSG00000029054, ENSMUSG00000043531, ENSMUSG00000027577, ENSMUSG00000001986, ENSMUSG00000033981, ENSMUSG00000001985, ENSMUSG00000053004, ENSMUSG00000081683, ENSMUSG00000041907, ENSMUSG00000020524, ENSMUSG00000003378, ENSMUSG00000034987, ENSMUSG00000037579, ENSMUSG00000018500, ENSMUSG00000050511, ENSMUSG00000059003, ENSMUSG00000026424, ENSMUSG00000021451, ENSMUSG00000050761, ENSMUSG00000068037, ENSMUSG00000068748, ENSMUSG00000001260, ENSMUSG00000045967, ENSMUSG00000028444, ENSMUSG00000035557, ENSMUSG00000030223, ENSMUSG00000027071, ENSMUSG00000027316, ENSMUSG00000049928, ENSMUSG00000040133, ENSMUSG00000043811, ENSMUSG00000044288, ENSMUSG00000039809, ENSMUSG00000059146, ENSMUSG00000063239, ENSMUSG00000055471, ENSMUSG00000031870, ENSMUSG00000078735, ENSMUSG00000026959, ENSMUSG00000026271, ENSMUSG00000022758, ENSMUSG00000060534, ENSMUSG00000008734, ENSMUSG00000035580, ENSMUSG00000008318, ENSMUSG00000021796, ENSMUSG00000020591, ENSMUSG00000042804, ENSMUSG00000050164, ENSMUSG00000028469, ENSMUSG00000036832, ENSMUSG00000023473, ENSMUSG00000056679, ENSMUSG00000078771, ENSMUSG00000018166, ENSMUSG00000040899, ENSMUSG00000041423, ENSMUSG00000015702, ENSMUSG00000018634, ENSMUSG00000063434, ENSMUSG00000031343, ENSMUSG00000031613, ENSMUSG00000039904, ENSMUSG00000031385, ENSMUSG00000035431, ENSMUSG00000024211, ENSMUSG00000027335, ENSMUSG00000050783, ENSMUSG00000005087, ENSMUSG00000027297, ENSMUSG00000050288, ENSMUSG00000045875, ENSMUSG00000029468, ENSMUSG00000032262, ENSMUSG00000054252, ENSMUSG00000003534, ENSMUSG00000033774, ENSMUSG00000050824, ENSMUSG00000049409, ENSMUSG00000052516, ENSMUSG00000030209, ENSMUSG00000022122, ENSMUSG00000040125, ENSMUSG00000028778, ENSMUSG00000024462, ENSMUSG00000055254, ENSMUSG00000029211, ENSMUSG00000047259, ENSMUSG00000022935, ENSMUSG00000074785, ENSMUSG00000036766, ENSMUSG00000027950, ENSMUSG00000008090, ENSMUSG00000028664, ENSMUSG00000036353, ENSMUSG00000029778, ENSMUSG00000031932, ENSMUSG00000050541, ENSMUSG00000052229, ENSMUSG00000072875, ENSMUSG00000013236, ENSMUSG00000055026, ENSMUSG00000025892, ENSMUSG00000045509, ENSMUSG00000046961, ENSMUSG00000002771, ENSMUSG00000000532, ENSMUSG00000039059, ENSMUSG00000035283, ENSMUSG00000035594, ENSMUSG00000041078, ENSMUSG00000061393, ENSMUSG00000042429, ENSMUSG00000032584, ENSMUSG00000027584, ENSMUSG00000020447, ENSMUSG00000026251, ENSMUSG00000021313, ENSMUSG00000020963, ENSMUSG00000033768, ENSMUSG00000020140, ENSMUSG00000031861, ENSMUSG00000030525","Vldlr, Ptprf, Gpr75, Sorl1, Sstr3, Ptpru, Rorb, Ptprn2, Kiss1r, Gpr34, Grik4, Nr2e1, Nrxn1, P2ry1, Gabra2, Ntsr1, Erbb4, F3, Igsf1, Grin3a, Paqr8, Npc1, Fgfr2, Nr2f1, Ryr1, Gpr25, Sorcs2, Htr5a, Gpr15, Agtr1a, Gpr3, Rgma, Slc22a17, Plxna3, Gabrb1, Adra2c, Oprk1, Npsr1, Adrb3, Celsr2, Thrb, Rasa3, Efnb3, Nrxn3, Ramp1, Sfrp1, Epha5, Thra, Csf2ra, Htr1b, Npy5r, Cx3cr1, Grik2, Gpr162, Htr3b, Gpr19, Gpr179, Jph3, Olfr287, Gfra1, Vipr2, Gpr61, Ccr5, Drd2, Fzd9, Kcnh2, Grin2c, Galr2, Kcnh4, Lgr4, Grm5, Grm1, Cry2, Grm2, Tnfrsf21, Paqr9, Kcnh5, Zfp219, Rxrg, Lhcgr, Grid2, Htr6, Gpr88, Unc5c, Sfrp5, Gabrb3, Gabrd, Sorcs1, Chrna4, Gria3, Gria2, Grik3, Hrh1, Fzd10, Gpr45, Gria1, Grik5, Hrh2, Kcnh3, Adora2b, Oprd1, Grin2a, Gpr37l1, Sema4d, Gp1bb, Mas1, Ptprz1, Gabrg1, Gpr158, Cntfr, Krt17, Ptpro, P2rx3, Gfra4, Glp2r, Gpr176, Rtn4r, Cnr1, Gabbr2, Ntrk3, Grm4, Alk, Pgr, Il11ra2, Grin1, Gpr35, P2rx6, Dcc, Gprc5b, Kcnh8, Relt, Bmpr1a, Ntsr2, Gpr153, Mchr1, Npr2, Lpar3, Celsr3, Gpr173, Evi2a, Erbb3, Ccr6, Paqr6, Anxa9, Crhr1, Sorcs3, Gabra3, Hpgd, Gpr37, Plxnb3, Sstr1, Grm8, Adra1d, Htr1f, Cd44, Ltk, Fzd2, Adra1a, P2rx7, Elovl4, Fgfr3, Ddr1, Npbwr1, Sstr5, Prokr1, Robo2, Grin2b, Ednrb, Gpr26, Hcrtr1, Gabbr1, Ntrk2, Gabra4, Mc4r, Grik1, Plxnc1, Dner, Chrnb2, Fgfrl1, Ephb2, P2ry12, Adcyap1r1, Gpr83, Adra1b, Gpr17, Gpr27, Ptprs, Gabrg3, Gria4, Gpr150, Gpr156, Grin2d, Acvr1b, Hrh3, Adrb1, Chrna5, Grid1, Acvr2b, Adora1, Mst1r, Oprl1, Npc1l1, Chrnd, Ryr2, Tshr, Nrxn2, Lgr5, Lpar2, Chrna7"
"GO_GAP_JUNCTION_CHANNEL_ACTIVITY",16,0.125,0.125,"Down",0.54,0.70104375,"ENSMUSG00000047797, ENSMUSG00000058441","Gjb1, Panx2"
"GO_DIACYLGLYCEROL_KINASE_ACTIVITY",11,0.272727272727273,0.272727272727273,"Up",0.541,0.70104375,"ENSMUSG00000025357, ENSMUSG00000034731, ENSMUSG00000000276","Dgka, Dgkh, Dgke"
"GO_CCR_CHEMOKINE_RECEPTOR_BINDING",25,0.12,0.2,"Up",0.542,0.70104375,"ENSMUSG00000095675, ENSMUSG00000026166","Ccl21b, Ccl20"
"GO_PHOSPHORIC_ESTER_HYDROLASE_ACTIVITY",334,0.209580838323353,0.203592814371257,"Up",0.543,0.70104375,"ENSMUSG00000039480, ENSMUSG00000032908, ENSMUSG00000026753, ENSMUSG00000027346, ENSMUSG00000021987, ENSMUSG00000062168, ENSMUSG00000033278, ENSMUSG00000032477, ENSMUSG00000022092, ENSMUSG00000028771, ENSMUSG00000027248, ENSMUSG00000039943, ENSMUSG00000037628, ENSMUSG00000030703, ENSMUSG00000019990, ENSMUSG00000025240, ENSMUSG00000019989, ENSMUSG00000024539, ENSMUSG00000069255, ENSMUSG00000035958, ENSMUSG00000026544, ENSMUSG00000026181, ENSMUSG00000005232, ENSMUSG00000031842, ENSMUSG00000019889, ENSMUSG00000035314, ENSMUSG00000009630, ENSMUSG00000002228, ENSMUSG00000021745, ENSMUSG00000019872, ENSMUSG00000031337, ENSMUSG00000029038, ENSMUSG00000028788, ENSMUSG00000042988, ENSMUSG00000004455, ENSMUSG00000019960, ENSMUSG00000059895, ENSMUSG00000020154, ENSMUSG00000053965, ENSMUSG00000078650, ENSMUSG00000006127, ENSMUSG00000041231","Nt5dc1, Sgpp2, Ppp6c, Gpcpd1, Mtmr6, Ppef1, Ptprm, Cdc25a, Ppp3cc, Ptpn12, Pdia3, Plcb4, Cdkn3, Gdpd3, Pde7b, Sacm1l, Enpp3, Ptpn2, Dusp22, Tdp2, Dusp23, Ppm1f, G6pc2, Pde4c, Ptprk, Gdpd5, Ppp2cb, Ppm1j, Ptprg, Smpdl3a, Mtm1, Ssu72, Ptp4a2, Notum, Ppp1cc, Dusp6, Ptp4a3, Ptprb, Pde5a, G6pc, Inpp5k, Ublcp1"
"GO_NUCLEIC_ACID_BINDING_TRANSCRIPTION_FACTOR_ACTIVITY",991,0.171543895055499,0.20686175580222,"Up",0.544,0.70104375,"ENSMUSG00000063060, ENSMUSG00000025958, ENSMUSG00000025612, ENSMUSG00000071646, ENSMUSG00000050397, ENSMUSG00000034042, ENSMUSG00000040732, ENSMUSG00000025498, ENSMUSG00000030067, ENSMUSG00000038845, ENSMUSG00000022895, ENSMUSG00000094870, ENSMUSG00000019947, ENSMUSG00000022010, ENSMUSG00000027102, ENSMUSG00000066007, ENSMUSG00000040433, ENSMUSG00000020653, ENSMUSG00000028800, ENSMUSG00000038415, ENSMUSG00000020857, ENSMUSG00000031681, ENSMUSG00000021945, ENSMUSG00000024431, ENSMUSG00000000317, ENSMUSG00000054321, ENSMUSG00000027361, ENSMUSG00000009097, ENSMUSG00000002108, ENSMUSG00000037174, ENSMUSG00000070643, ENSMUSG00000001280, ENSMUSG00000031965, ENSMUSG00000027985, ENSMUSG00000024346, ENSMUSG00000044542, ENSMUSG00000032035, ENSMUSG00000032698, ENSMUSG00000039699, ENSMUSG00000005836, ENSMUSG00000059552, ENSMUSG00000036461, ENSMUSG00000022361, ENSMUSG00000038518, ENSMUSG00000037286, ENSMUSG00000015053, ENSMUSG00000031326, ENSMUSG00000046470, ENSMUSG00000063889, ENSMUSG00000008398, ENSMUSG00000025902, ENSMUSG00000030180, ENSMUSG00000050295, ENSMUSG00000024081, ENSMUSG00000008976, ENSMUSG00000049421, ENSMUSG00000037896, ENSMUSG00000030557, ENSMUSG00000031902, ENSMUSG00000068079, ENSMUSG00000050410, ENSMUSG00000057173, ENSMUSG00000051490, ENSMUSG00000038402, ENSMUSG00000032745, ENSMUSG00000071637, ENSMUSG00000037730, ENSMUSG00000000078, ENSMUSG00000002250, ENSMUSG00000000275, ENSMUSG00000038722, ENSMUSG00000026104, ENSMUSG00000048450, ENSMUSG00000033249, ENSMUSG00000022676, ENSMUSG00000040289, ENSMUSG00000001493, ENSMUSG00000054604, ENSMUSG00000021775, ENSMUSG00000022811, ENSMUSG00000074676, ENSMUSG00000024140, ENSMUSG00000024912, ENSMUSG00000021109, ENSMUSG00000027109, ENSMUSG00000000782, ENSMUSG00000042812, ENSMUSG00000020167, ENSMUSG00000026751, ENSMUSG00000032228, ENSMUSG00000015619, ENSMUSG00000022205, ENSMUSG00000030796, ENSMUSG00000031627, ENSMUSG00000059436, ENSMUSG00000024563, ENSMUSG00000027684, ENSMUSG00000020954, ENSMUSG00000036867, ENSMUSG00000019256, ENSMUSG00000057098, ENSMUSG00000026436, ENSMUSG00000002325, ENSMUSG00000006932, ENSMUSG00000051316, ENSMUSG00000030353, ENSMUSG00000062327, ENSMUSG00000043099, ENSMUSG00000067860, ENSMUSG00000030057, ENSMUSG00000026743, ENSMUSG00000024986, ENSMUSG00000016087, ENSMUSG00000029178, ENSMUSG00000075588, ENSMUSG00000055197, ENSMUSG00000003923, ENSMUSG00000055874, ENSMUSG00000042557, ENSMUSG00000044167, ENSMUSG00000000093, ENSMUSG00000018604, ENSMUSG00000032015, ENSMUSG00000054717, ENSMUSG00000000094","Sox7, Creb1, Bach1, Mta2, Foxl2, Gpbp1l1, Erg, Irf7, Foxp1, Phb, Ets2, Zfp131, Arid5b, Tsc22d1, Hoxd8, Zfp600, Zbtb38, Klf11, Hdac1, Foxq1, Nme2, Smad1, Zmym2, Nr3c1, Bcl6b, Taf4b, Gabpb1, Tbx1, Nr1h3, Elf2, Sox13, Sp1, Tbx20, Lef1, Pfdn1, Prop1, Ets1, Lmo2, Batf2, Gata6, Trp53, Elf1, Zhx1, Jarid2, Stag1, Gata2, Cdx4, Sox18, Crem, Elk3, Sox17, Kdm5a, Foxc1, Cebpz, Gabpa, Zfp260, Rcor1, Mef2a, Nfatc3, Tcf15, Tcf19, Rfx8, Foxd4, Foxf2, Gpbp1, Cebpd, Mynn, Klf6, Ppard, Trim25, Bud31, Stat1, Msx1, Hsf4, Snai2, Hey1, Meox1, Cggbp1, Nr1d2, Zfp148, Foxs1, Epas1, Fosl1, Hif1a, Sp3, Tcf7, Foxf1, Tcf3, Nr5a1, Tcf12, Gata3, Sub1, Tead2, Irf2, Max, Smad2, Mecom, Strn3, Smad6, Ahr, Ebf1, Elk4, Irf9, Ctnnb1, Taf7, Tead4, T, Hic1, Zic3, Cnbp, Mllt10, Hhex, Fli1, Klf3, Hoxb2, Fev, Tfam, Foxi3, Sin3a, Foxo1, Tbx2, Tbx3, Pou2f3, Hmgb2, Tbx4"
"GO_RRNA_METHYLTRANSFERASE_ACTIVITY",12,0.0833333333333333,0.166666666666667,"Down",0.544,0.70104375,"ENSMUSG00000051062","Fbll1"
"GO_MHC_CLASS_I_PROTEIN_BINDING",16,0.0625,0.125,"Up",0.544,0.70104375,"",""
