"","NGenes","PropDown","PropUp","Direction","PValue","FDR","differential_genes_gene_id","differential_genes_gene_name"
"GO_COFACTOR_BINDING",238,0.138655462184874,0.256302521008403,"Up",0.032,0.106269230769231,"ENSMUSG00000025486, ENSMUSG00000020917, ENSMUSG00000015806, ENSMUSG00000032126, ENSMUSG00000032350, ENSMUSG00000025260, ENSMUSG00000009863, ENSMUSG00000037916, ENSMUSG00000025153, ENSMUSG00000029776, ENSMUSG00000021594, ENSMUSG00000028937, ENSMUSG00000021957, ENSMUSG00000031400, ENSMUSG00000022680, ENSMUSG00000013593, ENSMUSG00000027187, ENSMUSG00000021235, ENSMUSG00000040888, ENSMUSG00000024426, ENSMUSG00000032763, ENSMUSG00000030979, ENSMUSG00000006378, ENSMUSG00000053398, ENSMUSG00000020153, ENSMUSG00000015149, ENSMUSG00000028603, ENSMUSG00000018042, ENSMUSG00000035637, ENSMUSG00000015970, ENSMUSG00000034926, ENSMUSG00000020475, ENSMUSG00000020456, ENSMUSG00000027984, ENSMUSG00000042410, ENSMUSG00000037373, ENSMUSG00000021468, ENSMUSG00000032418, ENSMUSG00000027618, ENSMUSG00000023019, ENSMUSG00000021884","Sirt3, Acly, Qdpr, Hmbs, Gclc, Hsd17b10, Sdhb, Ndufv1, Fasn, Hibadh, Srd5a1, Acot7, Tkt, G6pdx, Pdxdc1, Ndufs2, Cat, Coq6, Gfer, Atat1, Ilvbl, Uros, Gcat, Phgdh, Ndufs7, Sirt2, Scp2, Cyb5r3, Grhpr, Chdh, Dhcr24, Pgam2, Ogdh, Hadh, Agps, Ctbp1, Sptlc1, Me1, Nfs1, Gpd1, Hacl1"
"GO_PEPTIDASE_INHIBITOR_ACTIVITY",114,0.219298245614035,0.0964912280701754,"Down",0.032,0.106269230769231,"ENSMUSG00000021223, ENSMUSG00000024074, ENSMUSG00000020415, ENSMUSG00000026249, ENSMUSG00000067780, ENSMUSG00000020044, ENSMUSG00000025650, ENSMUSG00000032000, ENSMUSG00000026715, ENSMUSG00000055653, ENSMUSG00000024164, ENSMUSG00000024073, ENSMUSG00000031309, ENSMUSG00000030336, ENSMUSG00000039193, ENSMUSG00000025927, ENSMUSG00000017716, ENSMUSG00000022912, ENSMUSG00000045827, ENSMUSG00000047879","Papln, Crim1, Pttg1, Serpine2, Pi15, Timp3, Col7a1, Birc3, Serpinc1, Gpc3, C3, Birc6, Rps6ka3, Cd27, Nlrc4, Tfap2b, Birc5, Pros1, Serpinb9, Usp14"
"GO_BASAL_TRANSCRIPTION_MACHINERY_BINDING",23,0.217391304347826,0.0869565217391304,"Down",0.032,0.106269230769231,"ENSMUSG00000003549, ENSMUSG00000026020, ENSMUSG00000041328","Ercc1, Nop58, Pcf11"
"GO_RNA_DIRECTED_DNA_POLYMERASE_ACTIVITY",7,0.428571428571429,0.285714285714286,"Down",0.033,0.109242700729927,"ENSMUSG00000031921, ENSMUSG00000031403","Terf2, Dkc1"
"GO_PROTON_TRANSPORTING_ATP_SYNTHASE_ACTIVITY_ROTATIONAL_MECHANISM",10,0,0.4,"Up",0.034,0.11098381294964,"ENSMUSG00000022956, ENSMUSG00000003072","Atp5o, Atp5d"
"GO_CARBON_OXYGEN_LYASE_ACTIVITY",60,0.133333333333333,0.3,"Up",0.034,0.11098381294964,"ENSMUSG00000032126, ENSMUSG00000022477, ENSMUSG00000030979, ENSMUSG00000041429, ENSMUSG00000027562, ENSMUSG00000025153, ENSMUSG00000025465, ENSMUSG00000021460, ENSMUSG00000032067, ENSMUSG00000038526, ENSMUSG00000022853, ENSMUSG00000031536","Hmbs, Aco2, Uros, Nthl1, Car2, Fasn, Echs1, Auh, Pts, Car14, Ehhadh, Polb"
"GO_OXIDOREDUCTASE_ACTIVITY_ACTING_ON_THE_CH_CH_GROUP_OF_DONORS",51,0.0784313725490196,0.274509803921569,"Up",0.034,0.11098381294964,"ENSMUSG00000034926, ENSMUSG00000072946, ENSMUSG00000029233, ENSMUSG00000009863, ENSMUSG00000021594, ENSMUSG00000031708, ENSMUSG00000022742, ENSMUSG00000058076, ENSMUSG00000036138, ENSMUSG00000058454, ENSMUSG00000025153","Dhcr24, Ptgr2, Srd5a3, Sdhb, Srd5a1, Tecr, Cpox, Sdhc, Acaa1a, Dhcr7, Fasn"
"GO_PHOSPHATIDYLINOSITOL_3_5_BISPHOSPHATE_3_PHOSPHATASE_ACTIVITY",10,0,0.2,"Up",0.034,0.11098381294964,"ENSMUSG00000031918, ENSMUSG00000023805","Mtmr2, Synj2"
"GO_ACYLGLYCEROL_O_ACYLTRANSFERASE_ACTIVITY",25,0.2,0.32,"Up",0.035,0.113480357142857,"ENSMUSG00000038732, ENSMUSG00000023827, ENSMUSG00000034254, ENSMUSG00000032540, ENSMUSG00000030747, ENSMUSG00000001211","Mboat1, Agpat4, Agpat1, Abhd5, Dgat2, Agpat3"
"GO_NADP_BINDING",37,0.135135135135135,0.216216216216216,"Up",0.035,0.113480357142857,"ENSMUSG00000027187, ENSMUSG00000021594, ENSMUSG00000015806, ENSMUSG00000025153, ENSMUSG00000031400, ENSMUSG00000032418, ENSMUSG00000035637","Cat, Srd5a1, Qdpr, Fasn, G6pdx, Me1, Grhpr"
"GO_CALMODULIN_BINDING",170,0.258823529411765,0.111764705882353,"Down",0.036,0.115531802120141,"ENSMUSG00000009079, ENSMUSG00000020900, ENSMUSG00000057738, ENSMUSG00000057378, ENSMUSG00000051177, ENSMUSG00000001151, ENSMUSG00000030536, ENSMUSG00000036499, ENSMUSG00000021559, ENSMUSG00000020785, ENSMUSG00000026463, ENSMUSG00000021676, ENSMUSG00000031012, ENSMUSG00000038855, ENSMUSG00000028906, ENSMUSG00000022272, ENSMUSG00000024960, ENSMUSG00000041308, ENSMUSG00000021057, ENSMUSG00000033952, ENSMUSG00000019943, ENSMUSG00000028214, ENSMUSG00000022837, ENSMUSG00000017774, ENSMUSG00000018417, ENSMUSG00000020654, ENSMUSG00000035064, ENSMUSG00000028068, ENSMUSG00000026360","Ewsr1, Myh10, Sptan1, Ryr3, Plcb1, Pcnt, Iqgap1, Eea1, Dapk1, Camkk1, Atp2b4, Iqgap2, Cask, Itpkb, Epb41, Myo10, Plcb3, Sntb2, Akap5, Aspm, Atp2b1, Gem, Iqcb1, Myo1c, Myo1b, Adcy3, Eef2k, Iqgap3, Rgs2"
"GO_GLYCOPROTEIN_BINDING",92,0.239130434782609,0.0978260869565217,"Down",0.036,0.115531802120141,"ENSMUSG00000040152, ENSMUSG00000020592, ENSMUSG00000021823, ENSMUSG00000055653, ENSMUSG00000000303, ENSMUSG00000031328, ENSMUSG00000032384, ENSMUSG00000002633, ENSMUSG00000001507, ENSMUSG00000021549, ENSMUSG00000026728, ENSMUSG00000064302","Thbs1, Sdc1, Vcl, Gpc3, Cdh1, Flna, Csnk1g1, Shh, Itga3, Rasa1, Vim, Clasp1"
"GO_SCAVENGER_RECEPTOR_ACTIVITY",36,0.166666666666667,0.111111111111111,"Down",0.036,0.115531802120141,"ENSMUSG00000035459, ENSMUSG00000036103, ENSMUSG00000034205, ENSMUSG00000000693","Stab2, Colec12, Loxl2, Loxl3"
"GO_FOLIC_ACID_BINDING",10,0.4,0.1,"Down",0.037,0.118367957746479,"ENSMUSG00000001436, ENSMUSG00000025747","Slc19a1, Tyms"
"GO_G_PROTEIN_ALPHA_SUBUNIT_BINDING",21,0.333333333333333,0.0952380952380952,"Down",0.038,0.121184210526316,"ENSMUSG00000029101, ENSMUSG00000026360, ENSMUSG00000021478, ENSMUSG00000026228, ENSMUSG00000002458, ENSMUSG00000048376","Rgs12, Rgs2, Drd1, Htr2b, Rgs19, F2r"
"GO_LOW_DENSITY_LIPOPROTEIN_RECEPTOR_ACTIVITY",13,0.384615384615385,0.153846153846154,"Down",0.039,0.122270689655172,"ENSMUSG00000030201, ENSMUSG00000027070, ENSMUSG00000035459, ENSMUSG00000040249, ENSMUSG00000028613","Lrp6, Lrp2, Stab2, Lrp1, Lrp8"
"GO_WNT_PROTEIN_BINDING",28,0.357142857142857,0.0357142857142857,"Down",0.039,0.122270689655172,"ENSMUSG00000027996, ENSMUSG00000001761, ENSMUSG00000049791, ENSMUSG00000021464, ENSMUSG00000024913, ENSMUSG00000054196, ENSMUSG00000030201","Sfrp2, Smo, Fzd4, Ror2, Lrp5, Cthrc1, Lrp6"
"GO_DRUG_BINDING",101,0.277227722772277,0.0693069306930693,"Down",0.039,0.122270689655172,"ENSMUSG00000021699, ENSMUSG00000027804, ENSMUSG00000020681, ENSMUSG00000054717, ENSMUSG00000020914, ENSMUSG00000021478, ENSMUSG00000025747, ENSMUSG00000022041, ENSMUSG00000002732, ENSMUSG00000003355, ENSMUSG00000029366, ENSMUSG00000024477, ENSMUSG00000033016, ENSMUSG00000021069, ENSMUSG00000037992, ENSMUSG00000032525, ENSMUSG00000001761, ENSMUSG00000026770, ENSMUSG00000026228","Pde4d, Ppid, Ace, Hmgb2, Top2a, Drd1, Tyms, Chrna2, Fkbp7, Fkbp11, Dck, Pggt1b, Nfatc1, Pygl, Rara, Nktr, Smo, Il2ra, Htr2b"
"GO_HISTONE_LYSINE_N_METHYLTRANSFERASE_ACTIVITY",33,0.242424242424242,0.0606060606060606,"Down",0.039,0.122270689655172,"ENSMUSG00000015697, ENSMUSG00000044791, ENSMUSG00000038384, ENSMUSG00000036893, ENSMUSG00000028053, ENSMUSG00000026917, ENSMUSG00000020257","Setdb1, Setd2, Setd1b, Ehmt1, Ash1l, Wdr5, Wdr82"
"GO_ZINC_ION_TRANSMEMBRANE_TRANSPORTER_ACTIVITY",23,0.217391304347826,0.0869565217391304,"Down",0.039,0.122270689655172,"ENSMUSG00000063354, ENSMUSG00000021629, ENSMUSG00000025986, ENSMUSG00000072572","Slc39a4, Slc30a5, Slc39a10, Slc39a2"
"GO_PDZ_DOMAIN_BINDING",86,0.232558139534884,0.104651162790698,"Down",0.04,0.125015463917526,"ENSMUSG00000062232, ENSMUSG00000038388, ENSMUSG00000052155, ENSMUSG00000045377, ENSMUSG00000027162, ENSMUSG00000049791, ENSMUSG00000032076, ENSMUSG00000024074, ENSMUSG00000052373, ENSMUSG00000013663, ENSMUSG00000029516, ENSMUSG00000029287, ENSMUSG00000044365, ENSMUSG00000026463, ENSMUSG00000019943, ENSMUSG00000041498, ENSMUSG00000016520","Rapgef2, Mpp6, Acvr2a, Tmem88, Lin7c, Fzd4, Cadm1, Crim1, Mpp3, Pten, Cit, Tgfbr3, Cxxc4, Atp2b4, Atp2b1, Kif14, Lnx2"
"GO_WNT_ACTIVATED_RECEPTOR_ACTIVITY",21,0.333333333333333,0,"Down",0.041,0.126015202702703,"ENSMUSG00000024913, ENSMUSG00000030201, ENSMUSG00000027996, ENSMUSG00000001761, ENSMUSG00000049791","Lrp5, Lrp6, Sfrp2, Smo, Fzd4"
"GO_BETA_CATENIN_BINDING",78,0.320512820512821,0.115384615384615,"Down",0.041,0.126015202702703,"ENSMUSG00000034813, ENSMUSG00000022812, ENSMUSG00000026826, ENSMUSG00000055024, ENSMUSG00000032185, ENSMUSG00000059674, ENSMUSG00000053754, ENSMUSG00000000782, ENSMUSG00000079487, ENSMUSG00000048756, ENSMUSG00000000303, ENSMUSG00000025314, ENSMUSG00000000567, ENSMUSG00000021224, ENSMUSG00000021823, ENSMUSG00000018476, ENSMUSG00000002458, ENSMUSG00000031161, ENSMUSG00000003032, ENSMUSG00000032238","Grip1, Gsk3b, Nr4a2, Ep300, Carm1, Cdh24, Chd8, Tcf7, Med12, Foxo3, Cdh1, Ptprj, Sox9, Numb, Vcl, Kdm6b, Rgs19, Hdac6, Klf4, Rora"
"GO_MONOOXYGENASE_ACTIVITY",59,0.220338983050847,0.135593220338983,"Down",0.041,0.126015202702703,"ENSMUSG00000039783, ENSMUSG00000040046, ENSMUSG00000020098, ENSMUSG00000040703, ENSMUSG00000032323, ENSMUSG00000019823, ENSMUSG00000024087, ENSMUSG00000025479, ENSMUSG00000020000","Kmo, Tph1, Pcbd1, Cyp2s1, Cyp11a1, Mical1, Cyp1b1, Cyp2e1, Moxd1"
"GO_SECONDARY_ACTIVE_TRANSMEMBRANE_TRANSPORTER_ACTIVITY",210,0.219047619047619,0.10952380952381,"Down",0.041,0.126015202702703,"ENSMUSG00000041920, ENSMUSG00000079020, ENSMUSG00000001436, ENSMUSG00000040010, ENSMUSG00000040569, ENSMUSG00000040938, ENSMUSG00000031297, ENSMUSG00000023169, ENSMUSG00000009378, ENSMUSG00000027737, ENSMUSG00000017756, ENSMUSG00000043885, ENSMUSG00000025557, ENSMUSG00000005107, ENSMUSG00000037341, ENSMUSG00000021612, ENSMUSG00000027340, ENSMUSG00000032548, ENSMUSG00000050150, ENSMUSG00000020142, ENSMUSG00000037762, ENSMUSG00000028293, ENSMUSG00000027397, ENSMUSG00000021733, ENSMUSG00000026220, ENSMUSG00000009647, ENSMUSG00000014786, ENSMUSG00000033965, ENSMUSG00000024036, ENSMUSG00000028217, ENSMUSG00000025938","Slc16a6, Slc45a4, Slc19a1, Slc7a5, Slc26a7, Slc16a11, Slc7a3, Slc38a1, Slc16a12, Slc7a11, Slc12a7, Slc36a4, Slc15a1, Slc2a9, Slc9a7, Slc6a18, Slc23a2, Slco2a1, Slc9b1, Slc1a4, Slc16a9, Slc35a1, Slc20a1, Slc4a7, Slc16a14, Mcu, Slc9a5, Slc16a2, Slc37a1, Cdh17, Slco5a1"
"GO_ENZYME_ACTIVATOR_ACTIVITY",421,0.199524940617577,0.140142517814727,"Down",0.041,0.126015202702703,"ENSMUSG00000029174, ENSMUSG00000074934, ENSMUSG00000021676, ENSMUSG00000034160, ENSMUSG00000001173, ENSMUSG00000037458, ENSMUSG00000002297, ENSMUSG00000021948, ENSMUSG00000039585, ENSMUSG00000051177, ENSMUSG00000054051, ENSMUSG00000037627, ENSMUSG00000030536, ENSMUSG00000028175, ENSMUSG00000078185, ENSMUSG00000023247, ENSMUSG00000023015, ENSMUSG00000036501, ENSMUSG00000031214, ENSMUSG00000031523, ENSMUSG00000000957, ENSMUSG00000036452, ENSMUSG00000041225, ENSMUSG00000030560, ENSMUSG00000033083, ENSMUSG00000020541, ENSMUSG00000019979, ENSMUSG00000031709, ENSMUSG00000022957, ENSMUSG00000021193, ENSMUSG00000002458, ENSMUSG00000044037, ENSMUSG00000022377, ENSMUSG00000067629, ENSMUSG00000011831, ENSMUSG00000032688, ENSMUSG00000003134, ENSMUSG00000032392, ENSMUSG00000029101, ENSMUSG00000058835, ENSMUSG00000027665, ENSMUSG00000031355, ENSMUSG00000062232, ENSMUSG00000024122, ENSMUSG00000047139, ENSMUSG00000042700, ENSMUSG00000020599, ENSMUSG00000027699, ENSMUSG00000021027, ENSMUSG00000006262, ENSMUSG00000023979, ENSMUSG00000019487, ENSMUSG00000028245, ENSMUSG00000019790, ENSMUSG00000028068, ENSMUSG00000028577, ENSMUSG00000027996, ENSMUSG00000026360, ENSMUSG00000022799, ENSMUSG00000040687, ENSMUSG00000028944, ENSMUSG00000037410, ENSMUSG00000033721, ENSMUSG00000026228, ENSMUSG00000011958, ENSMUSG00000021549, ENSMUSG00000006369","Tbc1d1, Grem1, Iqgap2, Ogt, Ocrl, Azin1, Dbf4, Prkcd, Myo9a, Plcb1, Ercc6, Rgs22, Iqgap1, Depdc1a, Chml, Guca2a, Racgap1, Fam13b, Ophn1, Dlc1, Mmp14, Arhgap26, Arhgap12, Ctsc, Tbc1d4, Tom1l1, Apaf1, Tbc1d9, Itsn1, Pitrm1, Rgs19, Als2cl, Asap1, Syngap1, Evi5, Malt1, Tbc1d8, Parp16, Rgs12, Abi1, Pik3ca, Arhgap6, Rapgef2, Pdpk1, Cd24a, Sipa1l1, Rgs9, Ect2, Ralgapa1, Mob1b, Guca1b, Trip10, Nsmaf, Stxbp5, Iqgap3, Plaa, Sfrp2, Rgs2, Arhgap31, Madd, Prkag2, Tbc1d2b, Vav3, Htr2b, Bnip2, Rasa1, Fbln1"
"GO_TRANSFERASE_ACTIVITY_TRANSFERRING_SULFUR_CONTAINING_GROUPS",54,0.111111111111111,0.259259259259259,"Up",0.042,0.128260067114094,"ENSMUSG00000015536, ENSMUSG00000051022, ENSMUSG00000036138, ENSMUSG00000071711, ENSMUSG00000034118, ENSMUSG00000027618, ENSMUSG00000020811, ENSMUSG00000069020, ENSMUSG00000054008, ENSMUSG00000035930, ENSMUSG00000049721","Mocs2, Hs3st1, Acaa1a, Mpst, Tpst1, Nfs1, Wscd1, Urm1, Ndst1, Chst4, Gal3st1"
"GO_BILE_ACID_TRANSMEMBRANE_TRANSPORTER_ACTIVITY",12,0.0833333333333333,0,"Down",0.042,0.128260067114094,"",""
"GO_LIPOPOLYSACCHARIDE_BINDING",17,0.176470588235294,0.0588235294117647,"Down",0.043,0.130911371237458,"ENSMUSG00000039005","Tlr4"
"GO_WATER_TRANSMEMBRANE_TRANSPORTER_ACTIVITY",12,0.416666666666667,0,"Down",0.046,0.138759933774834,"ENSMUSG00000028427, ENSMUSG00000028435","Aqp7, Aqp3"
"GO_UDP_GALACTOSYLTRANSFERASE_ACTIVITY",25,0.32,0.2,"Down",0.046,0.138759933774834,"ENSMUSG00000047878, ENSMUSG00000059479, ENSMUSG00000021504, ENSMUSG00000022793, ENSMUSG00000017929","A4galt, B3gnt8, B4galt7, B4galt4, B4galt5"
"GO_RNA_POLYMERASE_II_DISTAL_ENHANCER_SEQUENCE_SPECIFIC_DNA_BINDING",59,0.23728813559322,0.0677966101694915,"Down",0.046,0.138759933774834,"ENSMUSG00000025958, ENSMUSG00000026398, ENSMUSG00000037935, ENSMUSG00000028820, ENSMUSG00000033016, ENSMUSG00000040270, ENSMUSG00000079487, ENSMUSG00000028163, ENSMUSG00000021366, ENSMUSG00000020275","Creb1, Nr5a2, Smarce1, Sfpq, Nfatc1, Bach2, Med12, Nfkb1, Hivep1, Rel"
"GO_DIACYLGLYCEROL_BINDING",11,0.363636363636364,0.0909090909090909,"Down",0.047,0.141341584158416,"ENSMUSG00000062232, ENSMUSG00000028456, ENSMUSG00000032946","Rapgef2, Unc13b, Rasgrp2"
"GO_UBIQUITIN_SPECIFIC_PROTEASE_BINDING",10,0.1,0.4,"Up",0.048,0.1425,"ENSMUSG00000053119, ENSMUSG00000003813","Chmp3, Rad23a"
"GO_PROTEIN_SERINE_THREONINE_PHOSPHATASE_INHIBITOR_ACTIVITY",10,0.1,0.3,"Up",0.048,0.1425,"ENSMUSG00000037166","Ppp1r14a"
"GO_ALDO_KETO_REDUCTASE_NADP_ACTIVITY",18,0.222222222222222,0.277777777777778,"Up",0.048,0.1425,"ENSMUSG00000021123, ENSMUSG00000028743, ENSMUSG00000020621, ENSMUSG00000066441, ENSMUSG00000024646","Rdh12, Akr7a5, Rdh14, Rdh11, Cyb5a"
"GO_SOLUTE_SODIUM_SYMPORTER_ACTIVITY",48,0.1875,0.0625,"Down",0.048,0.1425,"ENSMUSG00000027397, ENSMUSG00000023169, ENSMUSG00000021612, ENSMUSG00000020142, ENSMUSG00000027340","Slc20a1, Slc38a1, Slc6a18, Slc1a4, Slc23a2"
"GO_PEPTIDASE_REGULATOR_ACTIVITY",147,0.204081632653061,0.0952380952380952,"Down",0.049,0.144558252427184,"ENSMUSG00000045827, ENSMUSG00000047879, ENSMUSG00000020415, ENSMUSG00000039193, ENSMUSG00000017716, ENSMUSG00000025927, ENSMUSG00000022912, ENSMUSG00000024164, ENSMUSG00000055653, ENSMUSG00000027996, ENSMUSG00000026715, ENSMUSG00000030560, ENSMUSG00000031309, ENSMUSG00000024073, ENSMUSG00000030336, ENSMUSG00000000957, ENSMUSG00000026249, ENSMUSG00000067780, ENSMUSG00000024074, ENSMUSG00000021223, ENSMUSG00000006369, ENSMUSG00000020044, ENSMUSG00000019979, ENSMUSG00000025650, ENSMUSG00000032000","Serpinb9, Usp14, Pttg1, Nlrc4, Birc5, Tfap2b, Pros1, C3, Gpc3, Sfrp2, Serpinc1, Ctsc, Rps6ka3, Birc6, Cd27, Mmp14, Serpine2, Pi15, Crim1, Papln, Fbln1, Timp3, Apaf1, Col7a1, Birc3"
"GO_PEPTIDASE_ACTIVITY",503,0.184890656063618,0.184890656063618,"Down",0.049,0.144558252427184,"ENSMUSG00000031826, ENSMUSG00000022894, ENSMUSG00000030022, ENSMUSG00000022893, ENSMUSG00000036990, ENSMUSG00000043411, ENSMUSG00000029061, ENSMUSG00000039899, ENSMUSG00000020131, ENSMUSG00000000957, ENSMUSG00000024164, ENSMUSG00000030560, ENSMUSG00000049538, ENSMUSG00000022710, ENSMUSG00000058145, ENSMUSG00000043943, ENSMUSG00000005501, ENSMUSG00000037808, ENSMUSG00000052917, ENSMUSG00000047879, ENSMUSG00000058290, ENSMUSG00000046269, ENSMUSG00000047497, ENSMUSG00000024299, ENSMUSG00000020282, ENSMUSG00000002633, ENSMUSG00000032363, ENSMUSG00000059901, ENSMUSG00000067215, ENSMUSG00000033364, ENSMUSG00000026029, ENSMUSG00000059263, ENSMUSG00000032267, ENSMUSG00000053441, ENSMUSG00000033538, ENSMUSG00000024713, ENSMUSG00000022855, ENSMUSG00000008438, ENSMUSG00000045210, ENSMUSG00000090115, ENSMUSG00000056342, ENSMUSG00000043415, ENSMUSG00000022842, ENSMUSG00000021193, ENSMUSG00000006538, ENSMUSG00000053687, ENSMUSG00000042501, ENSMUSG00000021893, ENSMUSG00000034252, ENSMUSG00000040455, ENSMUSG00000061259, ENSMUSG00000023845, ENSMUSG00000028864, ENSMUSG00000025076, ENSMUSG00000051306, ENSMUSG00000037005, ENSMUSG00000029165, ENSMUSG00000041161, ENSMUSG00000021223, ENSMUSG00000024527, ENSMUSG00000019850, ENSMUSG00000020681, ENSMUSG00000021583, ENSMUSG00000032591, ENSMUSG00000016239, ENSMUSG00000032688, ENSMUSG00000023903, ENSMUSG00000033075, ENSMUSG00000027408, ENSMUSG00000028514","Usp10, Adamts5, Adamts9, Adamts1, Otud4, Usp48, Mmp23, Fgl2, Pcsk4, Mmp14, C3, Ctsc, Adamts16, Usp7, Adamts17, Naalad2, Usp40, Fam76b, Senp7, Usp14, Espl1, Usp27x, Adamts12, Adamts10, Rhbdf1, Shh, Adamts7, Adamts14, Usp51, Usp37, Casp8, Usp47, Usp28, Adamts19, Casp4, Pcsk5, Senp2, Adam21, Vcpip1, Usp49, Usp34, Otud1, Ece2, Pitrm1, Ihh, Dpep2, Cpa6, Capn7, Senp6, Usp45, Tmprss11d, Lnpep, Hgf, Casp7, Usp42, Xpnpep2, Agbl5, Otud3, Papln, Afg3l2, Tnfaip3, Ace, Erap1, Mst1, Lonrf3, Malt1, Mmp25, Senp1, Cpxm1, Usp24"
"GO_PHOSPHATASE_ACTIVATOR_ACTIVITY",8,0,0.375,"Up",0.05,0.146120192307692,"ENSMUSG00000071649, ENSMUSG00000002658","B3gat3, Gtf2f1"
"GO_POLY_A_BINDING",11,0.272727272727273,0.0909090909090909,"Down",0.05,0.146120192307692,"ENSMUSG00000000787, ENSMUSG00000071337, ENSMUSG00000032423","Ddx3x, Tia1, Syncrip"
"GO_O_METHYLTRANSFERASE_ACTIVITY",13,0.153846153846154,0.230769230769231,"Up",0.05,0.146120192307692,"ENSMUSG00000030763, ENSMUSG00000039662","Lcmt1, Icmt"
"GO_ALDEHYDE_DEHYDROGENASE_NAD_ACTIVITY",19,0.157894736842105,0.263157894736842,"Up",0.051,0.148122611464968,"ENSMUSG00000010025, ENSMUSG00000075296, ENSMUSG00000028138, ENSMUSG00000024885","Aldh3a2, Aldh3b2, Adh5, Aldh3b1"
"GO_ENDOPEPTIDASE_ACTIVITY",333,0.186186186186186,0.174174174174174,"Down",0.051,0.148122611464968,"ENSMUSG00000024713, ENSMUSG00000032688, ENSMUSG00000033538, ENSMUSG00000032591, ENSMUSG00000023903, ENSMUSG00000008438, ENSMUSG00000033075, ENSMUSG00000022855, ENSMUSG00000033364, ENSMUSG00000026029, ENSMUSG00000053441, ENSMUSG00000021583, ENSMUSG00000024527, ENSMUSG00000059901, ENSMUSG00000020681, ENSMUSG00000028864, ENSMUSG00000020282, ENSMUSG00000025076, ENSMUSG00000024299, ENSMUSG00000047497, ENSMUSG00000032363, ENSMUSG00000021223, ENSMUSG00000047879, ENSMUSG00000058290, ENSMUSG00000022710, ENSMUSG00000061259, ENSMUSG00000049538, ENSMUSG00000058145, ENSMUSG00000037808, ENSMUSG00000000957, ENSMUSG00000020131, ENSMUSG00000030560, ENSMUSG00000021893, ENSMUSG00000024164, ENSMUSG00000056342, ENSMUSG00000090115, ENSMUSG00000031826, ENSMUSG00000022894, ENSMUSG00000030022, ENSMUSG00000029061, ENSMUSG00000021193, ENSMUSG00000022893, ENSMUSG00000022842","Pcsk5, Malt1, Casp4, Mst1, Mmp25, Adam21, Senp1, Senp2, Usp37, Casp8, Adamts19, Erap1, Afg3l2, Adamts14, Ace, Hgf, Rhbdf1, Casp7, Adamts10, Adamts12, Adamts7, Papln, Usp14, Espl1, Usp7, Tmprss11d, Adamts16, Adamts17, Fam76b, Mmp14, Pcsk4, Ctsc, Capn7, C3, Usp34, Usp49, Usp10, Adamts5, Adamts9, Mmp23, Pitrm1, Adamts1, Ece2"
"GO_CYSTEINE_TYPE_ENDOPEPTIDASE_INHIBITOR_ACTIVITY",37,0.297297297297297,0.0540540540540541,"Down",0.052,0.1496261829653,"ENSMUSG00000020415, ENSMUSG00000024073, ENSMUSG00000031309, ENSMUSG00000045827, ENSMUSG00000039193, ENSMUSG00000032000, ENSMUSG00000025927, ENSMUSG00000030336, ENSMUSG00000017716","Pttg1, Birc6, Rps6ka3, Serpinb9, Nlrc4, Birc3, Tfap2b, Cd27, Birc5"
"GO_PHOSPHOLIPID_TRANSPORTER_ACTIVITY",42,0.261904761904762,0.166666666666667,"Down",0.052,0.1496261829653,"ENSMUSG00000064210, ENSMUSG00000074139, ENSMUSG00000060671, ENSMUSG00000015243, ENSMUSG00000032377, ENSMUSG00000040430, ENSMUSG00000024851, ENSMUSG00000046808, ENSMUSG00000020189, ENSMUSG00000062949","Ano6, 1700057G04Rik, Atp8b2, Abca1, Plscr4, Pitpnc1, Pitpnm1, Atp10d, Osbpl8, Atp11c"
"GO_OXIDOREDUCTASE_ACTIVITY_ACTING_ON_PAIRED_DONORS_WITH_INCORPORATION_OR_REDUCTION_OF_MOLECULAR_OXYGEN",108,0.175925925925926,0.12037037037037,"Down",0.052,0.1496261829653,"ENSMUSG00000040703, ENSMUSG00000039783, ENSMUSG00000079036, ENSMUSG00000020000, ENSMUSG00000024087, ENSMUSG00000040046, ENSMUSG00000028207, ENSMUSG00000020098, ENSMUSG00000032323, ENSMUSG00000019823, ENSMUSG00000032487, ENSMUSG00000040943, ENSMUSG00000021263, ENSMUSG00000025479","Cyp2s1, Kmo, Alkbh1, Moxd1, Cyp1b1, Tph1, Asph, Pcbd1, Cyp11a1, Mical1, Ptgs2, Tet2, Degs2, Cyp2e1"
"GO_INTRACELLULAR_LIGAND_GATED_ION_CHANNEL_ACTIVITY",27,0.259259259259259,0.037037037037037,"Down",0.053,0.152051886792453,"ENSMUSG00000048677, ENSMUSG00000026114, ENSMUSG00000034462, ENSMUSG00000057378","Tpcn2, Cnga3, Pkd2, Ryr3"
"GO_LOW_DENSITY_LIPOPROTEIN_PARTICLE_BINDING",15,0.2,0.0666666666666667,"Down",0.054,0.154462382445141,"ENSMUSG00000040152, ENSMUSG00000035459, ENSMUSG00000036103","Thbs1, Stab2, Colec12"
"GO_ENDORIBONUCLEASE_ACTIVITY_PRODUCING_5_PHOSPHOMONOESTERS",26,0.153846153846154,0.269230769230769,"Up",0.055,0.155883540372671,"ENSMUSG00000030423, ENSMUSG00000020630, ENSMUSG00000021418, ENSMUSG00000021932","Pop4, Rnaseh1, Rpp40, Rnaseh2b"
"GO_KINASE_INHIBITOR_ACTIVITY",83,0.265060240963855,0.144578313253012,"Down",0.055,0.155883540372671,"ENSMUSG00000047281, ENSMUSG00000032578, ENSMUSG00000052316, ENSMUSG00000038037, ENSMUSG00000015937, ENSMUSG00000032601, ENSMUSG00000032501, ENSMUSG00000045671, ENSMUSG00000028944, ENSMUSG00000047414, ENSMUSG00000051379, ENSMUSG00000020601, ENSMUSG00000048379, ENSMUSG00000030201, ENSMUSG00000051228, ENSMUSG00000010047, ENSMUSG00000069135","Sfn, Cish, Lrrc15, Socs1, H2afy, Prkar2a, Trib1, Spred2, Prkag2, Flrt2, Flrt3, Trib2, Socs4, Lrp6, Nyx, Hyal2, Fgfr1op"
"GO_SYMPORTER_ACTIVITY",134,0.194029850746269,0.111940298507463,"Down",0.055,0.155883540372671,"ENSMUSG00000027340, ENSMUSG00000020142, ENSMUSG00000028293, ENSMUSG00000037762, ENSMUSG00000027397, ENSMUSG00000021733, ENSMUSG00000026220, ENSMUSG00000033965, ENSMUSG00000041920, ENSMUSG00000079020, ENSMUSG00000040938, ENSMUSG00000023169, ENSMUSG00000009378, ENSMUSG00000017756, ENSMUSG00000043885, ENSMUSG00000025557, ENSMUSG00000005107, ENSMUSG00000021612","Slc23a2, Slc1a4, Slc35a1, Slc16a9, Slc20a1, Slc4a7, Slc16a14, Slc16a2, Slc16a6, Slc45a4, Slc16a11, Slc38a1, Slc16a12, Slc12a7, Slc36a4, Slc15a1, Slc2a9, Slc6a18"
"GO_CYSTEINE_TYPE_ENDOPEPTIDASE_ACTIVITY_INVOLVED_IN_APOPTOTIC_PROCESS",12,0.333333333333333,0,"Down",0.056,0.157763888888889,"ENSMUSG00000033538, ENSMUSG00000026029, ENSMUSG00000025076","Casp4, Casp8, Casp7"
"GO_HISTONE_DEMETHYLASE_ACTIVITY",23,0.217391304347826,0.0434782608695652,"Down",0.056,0.157763888888889,"ENSMUSG00000037876, ENSMUSG00000036940, ENSMUSG00000018476, ENSMUSG00000053470","Jmjd1c, Kdm1a, Kdm6b, Kdm3a"
"GO_ACETYLTRANSFERASE_ACTIVITY",89,0.280898876404494,0.168539325842697,"Down",0.057,0.158555389221557,"ENSMUSG00000063273, ENSMUSG00000020804, ENSMUSG00000037935, ENSMUSG00000024293, ENSMUSG00000024260, ENSMUSG00000027185, ENSMUSG00000041147, ENSMUSG00000029670, ENSMUSG00000025049, ENSMUSG00000021608, ENSMUSG00000026917, ENSMUSG00000042719, ENSMUSG00000034160, ENSMUSG00000035021, ENSMUSG00000022034, ENSMUSG00000029238, ENSMUSG00000021767, ENSMUSG00000020647, ENSMUSG00000022521, ENSMUSG00000055024, ENSMUSG00000017210, ENSMUSG00000005447, ENSMUSG00000024240","Naa15, Aanat, Smarce1, Esco1, Sap130, Nat10, Brca2, Ing3, Taf5, Lpcat1, Wdr5, Naa25, Ogt, Baz1a, Esco2, Clock, Kat6b, Ncoa1, Crebbp, Ep300, Med24, Pafah1b3, Epc1"
"GO_PALMITOYLTRANSFERASE_ACTIVITY",33,0.181818181818182,0.272727272727273,"Up",0.057,0.158555389221557,"ENSMUSG00000021468, ENSMUSG00000015335, ENSMUSG00000028607, ENSMUSG00000025786, ENSMUSG00000036985, ENSMUSG00000001844","Sptlc1, Zdhhc12, Cpt2, Zdhhc3, Zdhhc9, Zdhhc4"
"GO_TRANSLATION_REPRESSOR_ACTIVITY",19,0.263157894736842,0.105263157894737,"Down",0.057,0.158555389221557,"ENSMUSG00000079259, ENSMUSG00000037992, ENSMUSG00000005506, ENSMUSG00000020091","Trim71, Rara, Celf1, Eif4ebp2"
"GO_3_5_CYCLIC_AMP_PHOSPHODIESTERASE_ACTIVITY",14,0.428571428571429,0.0714285714285714,"Down",0.058,0.158555389221557,"ENSMUSG00000021684, ENSMUSG00000019990, ENSMUSG00000021699","Pde8b, Pde7b, Pde4d"
"GO_TRANSMEMBRANE_RECEPTOR_PROTEIN_TYROSINE_KINASE_ACTIVITY",59,0.372881355932203,0.101694915254237,"Down",0.058,0.158555389221557,"ENSMUSG00000032336, ENSMUSG00000042817, ENSMUSG00000005320, ENSMUSG00000024074, ENSMUSG00000021464, ENSMUSG00000031595, ENSMUSG00000059146, ENSMUSG00000030110, ENSMUSG00000005533, ENSMUSG00000052504, ENSMUSG00000026674, ENSMUSG00000025810, ENSMUSG00000006445, ENSMUSG00000025969, ENSMUSG00000005534","Nptn, Flt3, Fgfr4, Crim1, Ror2, Pdgfrl, Ntrk3, Ret, Igf1r, Epha3, Ddr2, Nrp1, Epha2, Nrp2, Insr"
"GO_GALACTOSYLTRANSFERASE_ACTIVITY",29,0.310344827586207,0.241379310344828,"Down",0.058,0.158555389221557,"ENSMUSG00000021504, ENSMUSG00000022793, ENSMUSG00000039242, ENSMUSG00000047878, ENSMUSG00000059479, ENSMUSG00000017929","B4galt7, B4galt4, B3galnt2, A4galt, B3gnt8, B4galt5"
"GO_METAL_CLUSTER_BINDING",59,0.135593220338983,0.305084745762712,"Up",0.058,0.158555389221557,"ENSMUSG00000020153, ENSMUSG00000037710, ENSMUSG00000041429, ENSMUSG00000022477, ENSMUSG00000038462, ENSMUSG00000024099, ENSMUSG00000078695, ENSMUSG00000009863, ENSMUSG00000027618, ENSMUSG00000037916, ENSMUSG00000013593, ENSMUSG00000024588, ENSMUSG00000039183, ENSMUSG00000021241","Ndufs7, Cisd1, Nthl1, Aco2, Uqcrfs1, Ndufv2, Cisd3, Sdhb, Nfs1, Ndufv1, Ndufs2, Fech, Nubp2, Isca2"
"GO_FILAMIN_BINDING",10,0.3,0.1,"Down",0.058,0.158555389221557,"ENSMUSG00000049488, ENSMUSG00000024501, ENSMUSG00000006219","Tmem67, Dpysl3, Fblim1"
