"","NGenes","PropDown","PropUp","Direction","PValue","FDR","differential_genes_gene_id","differential_genes_gene_name"
"GO_PHOSPHATASE_REGULATOR_ACTIVITY",78,0.256410256410256,0.179487179487179,"Down",0.175,0.35089262472885,"ENSMUSG00000030409, ENSMUSG00000101523, ENSMUSG00000029120, ENSMUSG00000024500, ENSMUSG00000043460, ENSMUSG00000026872, ENSMUSG00000073557, ENSMUSG00000036529, ENSMUSG00000054728, ENSMUSG00000040653, ENSMUSG00000033819, ENSMUSG00000035829, ENSMUSG00000029359, ENSMUSG00000021209, ENSMUSG00000022490, ENSMUSG00000027525, ENSMUSG00000020196, ENSMUSG00000048988","Dmpk, Gm10031, Ppp2r2c, Ppp2r2b, Elfn2, Zeb2, Ppp1r12b, Sbf1, Phactr1, Ppp1r14c, Ppp1r16a, Ppp1r26, Tesc, Ppp4r4, Ppp1r1a, Phactr3, Cabin1, Elfn1"
"GO_INOSITOL_PHOSPHATE_PHOSPHATASE_ACTIVITY",20,0.25,0.2,"Down",0.175,0.35089262472885,"ENSMUSG00000034570, ENSMUSG00000026925, ENSMUSG00000028894, ENSMUSG00000026113, ENSMUSG00000057963","Inpp5j, Inpp5e, Inpp5b, Inpp4a, Itpk1"
"GO_SULFATE_TRANSMEMBRANE_TRANSPORTER_ACTIVITY",13,0.384615384615385,0.153846153846154,"Down",0.177,0.352619612068965,"ENSMUSG00000046959, ENSMUSG00000001225, ENSMUSG00000029015, ENSMUSG00000036196, ENSMUSG00000023259","Slc26a1, Slc26a3, Slc26a5, Slc26a8, Slc26a6"
"GO_RAC_GTPASE_BINDING",37,0.216216216216216,0.243243243243243,"Up",0.177,0.352619612068965,"ENSMUSG00000030536, ENSMUSG00000022982, ENSMUSG00000007655, ENSMUSG00000038822, ENSMUSG00000002489","Iqgap1, Sod1, Cav1, Hace1, Tiam1"
"GO_PHOSPHOTRANSFERASE_ACTIVITY_FOR_OTHER_SUBSTITUTED_PHOSPHATE_GROUPS",18,0.166666666666667,0.222222222222222,"Up",0.177,0.352619612068965,"ENSMUSG00000050931, ENSMUSG00000040451","Sgms2, Sgms1"
"GO_CARBOHYDRATE_PHOSPHATASE_ACTIVITY",10,0.4,0.3,"Up",0.178,0.353095493562232,"ENSMUSG00000078650, ENSMUSG00000005232","G6pc, G6pc2"
"GO_ANION_CHANNEL_ACTIVITY",87,0.344827586206897,0.183908045977011,"Down",0.178,0.353095493562232,"ENSMUSG00000036196, ENSMUSG00000046959, ENSMUSG00000029212, ENSMUSG00000031343, ENSMUSG00000030428, ENSMUSG00000022843, ENSMUSG00000001225, ENSMUSG00000055026, ENSMUSG00000036570, ENSMUSG00000023259, ENSMUSG00000029211, ENSMUSG00000028020, ENSMUSG00000034863, ENSMUSG00000074968, ENSMUSG00000029015, ENSMUSG00000029054, ENSMUSG00000029862, ENSMUSG00000029016, ENSMUSG00000033676, ENSMUSG00000000560, ENSMUSG00000001260, ENSMUSG00000099041, ENSMUSG00000070570","Slc26a8, Slc26a1, Gabrb1, Gabra3, Ttyh1, Clcn2, Slc26a3, Gabrg3, Fxyd1, Slc26a6, Gabra4, Glrb, Ano8, Ano3, Slc26a5, Gabrd, Clcn1, Clcn6, Gabrb3, Gabra2, Gabrg1, Gm28035, Slc17a7"
"GO_ION_CHANNEL_BINDING",102,0.372549019607843,0.156862745098039,"Down",0.18,0.355548076923077,"ENSMUSG00000022564, ENSMUSG00000032511, ENSMUSG00000025221, ENSMUSG00000031137, ENSMUSG00000020894, ENSMUSG00000048070, ENSMUSG00000034402, ENSMUSG00000032839, ENSMUSG00000045246, ENSMUSG00000061603, ENSMUSG00000037386, ENSMUSG00000058975, ENSMUSG00000021143, ENSMUSG00000006457, ENSMUSG00000054640, ENSMUSG00000021313, ENSMUSG00000029104, ENSMUSG00000006930, ENSMUSG00000032827, ENSMUSG00000035226, ENSMUSG00000018909, ENSMUSG00000027488, ENSMUSG00000028207, ENSMUSG00000035681, ENSMUSG00000022523, ENSMUSG00000036570, ENSMUSG00000032890, ENSMUSG00000096146, ENSMUSG00000050556, ENSMUSG00000069601, ENSMUSG00000032826, ENSMUSG00000079056, ENSMUSG00000023092, ENSMUSG00000040896","Grina, Scn5a, Kcnip2, Fgf13, Vamp2, Pirt, Kcnh5, Trpc1, Kcng4, Akap6, Rims2, Kcnc1, Pacs2, Actn3, Slc8a1, Ryr2, Htt, Hap1, Ppp1r9a, Rims4, Arrb1, Snta1, Asph, Kcnc2, Fgf12, Fxyd1, Rims3, Kcnj11, Kcnb1, Ank3, Ank2, Kcnip3, Fhl1, Kcnd3"
"GO_CYCLIN_BINDING",19,0.157894736842105,0.368421052631579,"Up",0.18,0.355548076923077,"ENSMUSG00000003119, ENSMUSG00000004364, ENSMUSG00000041390, ENSMUSG00000041297, ENSMUSG00000025358, ENSMUSG00000019942","Cdk12, Cul3, Mdfic, Cdk13, Cdk2, Cdk1"
"GO_METALLOCARBOXYPEPTIDASE_ACTIVITY",25,0.2,0.12,"Down",0.183,0.360719616204691,"ENSMUSG00000027408, ENSMUSG00000001773, ENSMUSG00000030862, ENSMUSG00000040812","Cpxm1, Folh1, Cpxm2, Agbl2"
"GO_ALCOHOL_TRANSMEMBRANE_TRANSPORTER_ACTIVITY",22,0.136363636363636,0.136363636363636,"Down",0.184,0.361924468085106,"ENSMUSG00000032131","Abcg4"
"GO_NADH_DEHYDROGENASE_ACTIVITY",36,0,0.333333333333333,"Up",0.188,0.368246822033898,"ENSMUSG00000022450, ENSMUSG00000016427, ENSMUSG00000002416, ENSMUSG00000021764","Ndufa6, Ndufa1, Ndufb2, Ndufs4"
"GO_PEPTIDE_RECEPTOR_ACTIVITY",121,0.322314049586777,0.115702479338843,"Down",0.188,0.368246822033898,"ENSMUSG00000025905, ENSMUSG00000043659, ENSMUSG00000049928, ENSMUSG00000035773, ENSMUSG00000020793, ENSMUSG00000039904, ENSMUSG00000022122, ENSMUSG00000040899, ENSMUSG00000043999, ENSMUSG00000029093, ENSMUSG00000079227, ENSMUSG00000063434, ENSMUSG00000049409, ENSMUSG00000050824, ENSMUSG00000049115, ENSMUSG00000043531, ENSMUSG00000044933, ENSMUSG00000033774, ENSMUSG00000020591, ENSMUSG00000024107, ENSMUSG00000052336, ENSMUSG00000044014, ENSMUSG00000028469, ENSMUSG00000052229, ENSMUSG00000050164, ENSMUSG00000068037, ENSMUSG00000031932, ENSMUSG00000034353, ENSMUSG00000028778, ENSMUSG00000027568, ENSMUSG00000026424, ENSMUSG00000020963, ENSMUSG00000035431, ENSMUSG00000050511, ENSMUSG00000027584, ENSMUSG00000047259","Oprk1, Npsr1, Glp2r, Kiss1r, Galr2, Gpr37, Ednrb, Ccr6, Gpr75, Sorcs2, Ccr5, Sorcs3, Prokr1, Sstr5, Agtr1a, Sorcs1, Sstr3, Npbwr1, Ntsr2, Lhcgr, Cx3cr1, Npy5r, Npr2, Gpr17, Mchr1, Mas1, Gpr83, Ramp1, Hcrtr1, Ntsr1, Gpr37l1, Tshr, Sstr1, Oprd1, Oprl1, Mc4r"
"GO_S_ACYLTRANSFERASE_ACTIVITY",28,0.25,0.0714285714285714,"Down",0.189,0.369428118393235,"ENSMUSG00000036304, ENSMUSG00000039470, ENSMUSG00000025153, ENSMUSG00000034265, ENSMUSG00000060166, ENSMUSG00000048483","Zdhhc23, Zdhhc2, Fasn, Zdhhc14, Zdhhc8, Zdhhc22"
"GO_PLATELET_DERIVED_GROWTH_FACTOR_RECEPTOR_BINDING",14,0.214285714285714,0.285714285714286,"Up",0.19,0.370604430379747,"ENSMUSG00000026072, ENSMUSG00000032006","Il1r1, Pdgfd"
"GO_TUMOR_NECROSIS_FACTOR_RECEPTOR_SUPERFAMILY_BINDING",44,0.136363636363636,0.227272727272727,"Up",0.192,0.372942226890756,"ENSMUSG00000021583, ENSMUSG00000026104, ENSMUSG00000039304, ENSMUSG00000026883, ENSMUSG00000021408, ENSMUSG00000028362","Erap1, Stat1, Tnfsf10, Dab2ip, Ripk1, Tnfsf8"
"GO_MRNA_BINDING",142,0.176056338028169,0.204225352112676,"Up",0.192,0.372942226890756,"ENSMUSG00000037058, ENSMUSG00000022370, ENSMUSG00000026634, ENSMUSG00000068882, ENSMUSG00000025362, ENSMUSG00000000787, ENSMUSG00000096156, ENSMUSG00000026234, ENSMUSG00000025580, ENSMUSG00000020594, ENSMUSG00000012848, ENSMUSG00000022858, ENSMUSG00000025747, ENSMUSG00000027680, ENSMUSG00000036371, ENSMUSG00000040423, ENSMUSG00000024513, ENSMUSG00000024608","Paip2, Mrpl13, Angel2, Ssb, Rps26, Ddx3x, Gm9242, Ncl, Eif4a3, Pum2, Rps5, Tra2b, Tyms, Fxr1, Serbp1, Rc3h1, Mbd2, Rps14"
"GO_RECEPTOR_REGULATOR_ACTIVITY",45,0.222222222222222,0.0444444444444444,"Down",0.195,0.377990566037736,"ENSMUSG00000044254, ENSMUSG00000030093, ENSMUSG00000041014, ENSMUSG00000023951, ENSMUSG00000062991, ENSMUSG00000036856, ENSMUSG00000000125","Pcsk9, Wnt7a, Nrg3, Vegfa, Nrg1, Wnt4, Wnt3"
"GO_CHANNEL_REGULATOR_ACTIVITY",124,0.379032258064516,0.185483870967742,"Down",0.196,0.378347599164927,"ENSMUSG00000070304, ENSMUSG00000024034, ENSMUSG00000027257, ENSMUSG00000024109, ENSMUSG00000046093, ENSMUSG00000052889, ENSMUSG00000020723, ENSMUSG00000032259, ENSMUSG00000041460, ENSMUSG00000036815, ENSMUSG00000053395, ENSMUSG00000069806, ENSMUSG00000019194, ENSMUSG00000027488, ENSMUSG00000041245, ENSMUSG00000040373, ENSMUSG00000026463, ENSMUSG00000030987, ENSMUSG00000079056, ENSMUSG00000059412, ENSMUSG00000025221, ENSMUSG00000019146, ENSMUSG00000030525, ENSMUSG00000057914, ENSMUSG00000031137, ENSMUSG00000021991, ENSMUSG00000018470, ENSMUSG00000044254, ENSMUSG00000061576, ENSMUSG00000033768, ENSMUSG00000054934, ENSMUSG00000023192, ENSMUSG00000032105, ENSMUSG00000037624, ENSMUSG00000029053, ENSMUSG00000026514, ENSMUSG00000050947, ENSMUSG00000022523, ENSMUSG00000053519, ENSMUSG00000028931, ENSMUSG00000036570, ENSMUSG00000066392","Scn2b, Tmprss3, Pacsin3, Nrxn1, Hpcal4, Prkcb, Cacng4, Drd2, Cacna2d4, Dpp10, Cacng8, Cacng7, Scn1b, Snta1, Wnk3, Cacng5, Atp2b4, Stim1, Kcnip3, Fxyd2, Kcnip2, Cacng2, Chrna7, Cacnb2, Fgf13, Cacna2d3, Kcnab3, Pcsk9, Dpp6, Nrxn2, Kcnmb4, Grm2, Pdzd3, Kcnk2, Prkcz, Cnih3, Amigo1, Fgf12, Kcnip1, Kcnab2, Fxyd1, Nrxn3"
"GO_TRANSCRIPTION_FACTOR_ACTIVITY_RNA_POLYMERASE_II_DISTAL_ENHANCER_SEQUENCE_SPECIFIC_BINDING",88,0.136363636363636,0.238636363636364,"Up",0.196,0.378347599164927,"ENSMUSG00000005836, ENSMUSG00000021109, ENSMUSG00000025612, ENSMUSG00000022676, ENSMUSG00000022205, ENSMUSG00000025958, ENSMUSG00000050295, ENSMUSG00000062327, ENSMUSG00000044542, ENSMUSG00000030557, ENSMUSG00000038402, ENSMUSG00000025902, ENSMUSG00000027985, ENSMUSG00000026751, ENSMUSG00000042812","Gata6, Hif1a, Bach1, Snai2, Sub1, Creb1, Foxc1, T, Prop1, Mef2a, Foxf2, Sox17, Lef1, Nr5a1, Foxf1"
"GO_TRANSITION_METAL_ION_BINDING",1236,0.179611650485437,0.20631067961165,"Up",0.197,0.379490625,"ENSMUSG00000024234, ENSMUSG00000025423, ENSMUSG00000028397, ENSMUSG00000028392, ENSMUSG00000018585, ENSMUSG00000030022, ENSMUSG00000030407, ENSMUSG00000047648, ENSMUSG00000050445, ENSMUSG00000031145, ENSMUSG00000015889, ENSMUSG00000074207, ENSMUSG00000024477, ENSMUSG00000070327, ENSMUSG00000023348, ENSMUSG00000026193, ENSMUSG00000020841, ENSMUSG00000041712, ENSMUSG00000031996, ENSMUSG00000026751, ENSMUSG00000022982, ENSMUSG00000002297, ENSMUSG00000044339, ENSMUSG00000026283, ENSMUSG00000023914, ENSMUSG00000024317, ENSMUSG00000037730, ENSMUSG00000028978, ENSMUSG00000039616, ENSMUSG00000030254, ENSMUSG00000000275, ENSMUSG00000002250, ENSMUSG00000020186, ENSMUSG00000022057, ENSMUSG00000041926, ENSMUSG00000028902, ENSMUSG00000052763, ENSMUSG00000021902, ENSMUSG00000026579, ENSMUSG00000055128, ENSMUSG00000030629, ENSMUSG00000033792, ENSMUSG00000006356, ENSMUSG00000063851, ENSMUSG00000025317, ENSMUSG00000021775, ENSMUSG00000000889, ENSMUSG00000026468, ENSMUSG00000030057, ENSMUSG00000023963, ENSMUSG00000026743, ENSMUSG00000039234, ENSMUSG00000022280, ENSMUSG00000033107, ENSMUSG00000056537, ENSMUSG00000045996, ENSMUSG00000035021, ENSMUSG00000039068, ENSMUSG00000062168, ENSMUSG00000051355, ENSMUSG00000030782, ENSMUSG00000056962, ENSMUSG00000017969, ENSMUSG00000054693, ENSMUSG00000043279, ENSMUSG00000069189, ENSMUSG00000038068, ENSMUSG00000001604, ENSMUSG00000019872, ENSMUSG00000036459, ENSMUSG00000040296, ENSMUSG00000015619, ENSMUSG00000044224, ENSMUSG00000033596, ENSMUSG00000048410, ENSMUSG00000022468, ENSMUSG00000063049, ENSMUSG00000023903, ENSMUSG00000030750, ENSMUSG00000072941, ENSMUSG00000071350, ENSMUSG00000036040, ENSMUSG00000049439, ENSMUSG00000025085, ENSMUSG00000025185, ENSMUSG00000040423, ENSMUSG00000031209, ENSMUSG00000026484, ENSMUSG00000021945, ENSMUSG00000021103, ENSMUSG00000051236, ENSMUSG00000026987, ENSMUSG00000032376, ENSMUSG00000024561, ENSMUSG00000002108, ENSMUSG00000055239, ENSMUSG00000021969, ENSMUSG00000024431, ENSMUSG00000000805, ENSMUSG00000026335, ENSMUSG00000047821, ENSMUSG00000053581, ENSMUSG00000035958, ENSMUSG00000090733, ENSMUSG00000021493, ENSMUSG00000024560, ENSMUSG00000038876, ENSMUSG00000034205, ENSMUSG00000000420, ENSMUSG00000071646, ENSMUSG00000035248, ENSMUSG00000029552, ENSMUSG00000015405, ENSMUSG00000020682, ENSMUSG00000010067, ENSMUSG00000031711, ENSMUSG00000049502, ENSMUSG00000000320, ENSMUSG00000036073, ENSMUSG00000045969, ENSMUSG00000032051, ENSMUSG00000022634, ENSMUSG00000028024, ENSMUSG00000028098, ENSMUSG00000044792, ENSMUSG00000026977, ENSMUSG00000033813, ENSMUSG00000059474, ENSMUSG00000020826, ENSMUSG00000019808, ENSMUSG00000019326, ENSMUSG00000030180, ENSMUSG00000030884, ENSMUSG00000028684, ENSMUSG00000025782, ENSMUSG00000030670, ENSMUSG00000032000, ENSMUSG00000034639, ENSMUSG00000056144, ENSMUSG00000026896, ENSMUSG00000028259, ENSMUSG00000003226, ENSMUSG00000050410, ENSMUSG00000028273, ENSMUSG00000025860, ENSMUSG00000019920, ENSMUSG00000040483, ENSMUSG00000033368, ENSMUSG00000020448, ENSMUSG00000032698, ENSMUSG00000030413, ENSMUSG00000005836, ENSMUSG00000024085, ENSMUSG00000016520, ENSMUSG00000059552, ENSMUSG00000036822, ENSMUSG00000072872, ENSMUSG00000018239, ENSMUSG00000021583, ENSMUSG00000073968, ENSMUSG00000025193, ENSMUSG00000015053, ENSMUSG00000032080, ENSMUSG00000033228, ENSMUSG00000019820","Mtpap, Pias2, Kdm4c, Bspry, Atox1, Adamts9, Qpctl, Fbxo30, Cyp8b1, Prickle3, Lta4h, Adh1, Pggt1b, Rnf213, Trip6, Fn1, Cpd, Ubr7, Aplp2, Nr5a1, Sod1, Dbf4, Alkbh2, Ing5, Mep1a, Rnf138, Mynn, Nos3, Mocos, Rad18, Trim25, Ppard, Csrp2, Adamdec1, Rnpep, Sf3a3, Zfp212, Phf7, F5, Cgrrf1, Zfand6, Atp7a, Crip2, Rnf183, Car5a, Nr1d2, Dbh, Lhx4, Cnbp, Cyp39a1, Mllt10, Sec24d, Rnf19a, Rnf125, Rlim, Polr2k, Baz1a, Zzz3, Ppef1, Commd1, Tgfb1i1, Jmjd6, Ptgis, Adam10, Trim56, Zdhhc11, Rnf144b, Tcea3, Smpdl3a, Wtip, Ddx58, Gata3, Dnajc21, Rfwd3, Zfp407, Endou, Ing2, Mmp25, Nsmce1, Sod3, Setdb2, Adamtsl2, Cyp20a1, Ablim1, Loxl4, Rc3h1, Heph, Rnf2, Zmym2, Mnat1, Msrb3, Baz2b, Usp3, Mbd1, Nr1h3, Kcmf1, Zdhhc20, Nr3c1, Car4, Pam, Trim16, Zfand2a, Tdp2, Rps27, Pdlim7, Cxxc1, Rnf146, Loxl2, Galnt1, Mta2, Zcchc6, Tes, Ace2, Mmp28, Rassf1, Zfp330, Dtx3l, Alox12, Galt, Ing1, Fdx1, Yaf2, Enpep, Rnf115, Isca1, March7, Tcea1, Mbtd1, Nos2, Adat2, Aoc3, Kdm5a, Uqcrc2, Urod, Taf3, Cyp2r1, Birc3, Setmar, Trim34a, Ifih1, Fhl5, Ranbp2, Tcf19, Pdlim5, Xiap, Lims1, Xaf1, Trim69, Rnf185, Lmo2, Pglyrp1, Gata6, Man2a1, Lnx2, Trp53, Topors, Rybp, Zcchc10, Erap1, Trim68, Cutc, Gata2, Apoa4, Scaf11, Utrn"
"GO_GALACTOSYLTRANSFERASE_ACTIVITY",30,0.366666666666667,0.233333333333333,"Down",0.199,0.381312371134021,"ENSMUSG00000028541, ENSMUSG00000079445, ENSMUSG00000032854, ENSMUSG00000056124, ENSMUSG00000052423, ENSMUSG00000043300, ENSMUSG00000074004, ENSMUSG00000033849, ENSMUSG00000074892, ENSMUSG00000022686, ENSMUSG00000034780","B4galt2, B3gnt7, Ugt8a, B4galt6, B4galt3, B3galnt1, B3gnt6, B3galt2, B3galt5, B3gnt5, B3galt1"
"GO_ARYL_SULFOTRANSFERASE_ACTIVITY",7,0.142857142857143,0,"Down",0.199,0.381312371134021,"ENSMUSG00000018865","Sult4a1"
"GO_SINGLE_STRANDED_DNA_DEPENDENT_ATPASE_ACTIVITY",13,0,0.230769230769231,"Up",0.2,0.381312371134021,"ENSMUSG00000029363, ENSMUSG00000030254","Rfc5, Rad18"
"GO_PROTEIN_HOMODIMERIZATION_ACTIVITY",658,0.214285714285714,0.22644376899696,"Up",0.2,0.381312371134021,"ENSMUSG00000017299, ENSMUSG00000024986, ENSMUSG00000025747, ENSMUSG00000034639, ENSMUSG00000026048, ENSMUSG00000022206, ENSMUSG00000026150, ENSMUSG00000025289, ENSMUSG00000040675, ENSMUSG00000024151, ENSMUSG00000018340, ENSMUSG00000020826, ENSMUSG00000025060, ENSMUSG00000019326, ENSMUSG00000035000, ENSMUSG00000029802, ENSMUSG00000004364, ENSMUSG00000051669, ENSMUSG00000033543, ENSMUSG00000037062, ENSMUSG00000021186, ENSMUSG00000054693, ENSMUSG00000051355, ENSMUSG00000029198, ENSMUSG00000029910, ENSMUSG00000000617, ENSMUSG00000056962, ENSMUSG00000037936, ENSMUSG00000027680, ENSMUSG00000027366, ENSMUSG00000059436, ENSMUSG00000022797, ENSMUSG00000024563, ENSMUSG00000027684, ENSMUSG00000022051, ENSMUSG00000028165, ENSMUSG00000032487, ENSMUSG00000032228, ENSMUSG00000028249, ENSMUSG00000026278, ENSMUSG00000025630, ENSMUSG00000027835, ENSMUSG00000027907, ENSMUSG00000029148, ENSMUSG00000000058, ENSMUSG00000026880, ENSMUSG00000032080, ENSMUSG00000024844, ENSMUSG00000054808, ENSMUSG00000001930, ENSMUSG00000034845, ENSMUSG00000020572, ENSMUSG00000043931, ENSMUSG00000028480, ENSMUSG00000011179, ENSMUSG00000027803, ENSMUSG00000026836, ENSMUSG00000034484, ENSMUSG00000027456, ENSMUSG00000042240, ENSMUSG00000009097, ENSMUSG00000040433, ENSMUSG00000055737, ENSMUSG00000009907, ENSMUSG00000040952, ENSMUSG00000024234, ENSMUSG00000031921, ENSMUSG00000031681, ENSMUSG00000001280, ENSMUSG00000020167, ENSMUSG00000022982, ENSMUSG00000070732, ENSMUSG00000002365, ENSMUSG00000000296, ENSMUSG00000015143, ENSMUSG00000032902, ENSMUSG00000074643, ENSMUSG00000026175, ENSMUSG00000026104, ENSMUSG00000024659, ENSMUSG00000057530, ENSMUSG00000049791, ENSMUSG00000026305, ENSMUSG00000022824, ENSMUSG00000029521, ENSMUSG00000032041, ENSMUSG00000027861, ENSMUSG00000026883, ENSMUSG00000026814, ENSMUSG00000040511, ENSMUSG00000021192, ENSMUSG00000064210, ENSMUSG00000026277, ENSMUSG00000025925","Dnttip1, Hhex, Tyms, Setmar, Ercc5, Npr3, Mff, Prdx4, Mthfd1l, Msh2, Anxa6, Nos2, Slk, Aoc3, Dpp4, Abcg2, Cul3, AU021092, Gtf2a2, Sh3glb1, Fbln5, Adam10, Commd1, Grpel1, Mad2l1, Grm6, Jmjd6, Scarb1, Fxr1, Sppl2a, Max, Tfrc, Smad2, Mecom, Bnip3l, Cisd2, Ptgs2, Tcf12, Sdcbp, Bok, Hprt, Pdcd10, S100a11, Nrbp1, Cav2, Stom, Apoa4, Banf1, Actn4, Vwf, Plvap, Nampt, Gimap7, Glipr2, Odc1, Wwtr1, Acvr1, Snx2, Sdcbp2, Crybb2, Tbx1, Zbtb38, Ghr, Vps4b, Rps19, Mtpap, Terf2, Smad1, Sp1, Tcf3, Sod1, Rbm44, Snx9, Tpd52l1, Actn1, Slc16a1, Cpne1, Vil1, Stat1, Anxa1, Ece1, Fzd4, Lrrfip1, Muc13, Chek2, Tirap, Casq2, Dab2ip, Eng, Pvr, Golga5, Ano6, Stk25, Terf1"
"GO_G_PROTEIN_COUPLED_PHOTORECEPTOR_ACTIVITY",9,0.111111111111111,0,"Down",0.2,0.381312371134021,"ENSMUSG00000032262","Elovl4"
"GO_GLYCOPROTEIN_BINDING",96,0.21875,0.25,"Up",0.201,0.381649897330596,"ENSMUSG00000021823, ENSMUSG00000041936, ENSMUSG00000025809, ENSMUSG00000036231, ENSMUSG00000031701, ENSMUSG00000000157, ENSMUSG00000022797, ENSMUSG00000032207, ENSMUSG00000026580, ENSMUSG00000001930, ENSMUSG00000015405, ENSMUSG00000005397, ENSMUSG00000026728, ENSMUSG00000028249, ENSMUSG00000066366","Vcl, Agrn, Itgb1, Agr3, Dnaja2, Itgb2l, Tfrc, Lipc, Selp, Vwf, Ace2, Nid1, Vim, Sdcbp, Serpina1a"
"GO_DNA_HELICASE_ACTIVITY",50,0.08,0.24,"Up",0.201,0.381649897330596,"ENSMUSG00000043535, ENSMUSG00000023852, ENSMUSG00000000787, ENSMUSG00000038774, ENSMUSG00000028224","Setx, Chd1, Ddx3x, Ascc3, Nbn"
"GO_ANION_ANION_ANTIPORTER_ACTIVITY",22,0.318181818181818,0.136363636363636,"Down",0.203,0.384667008196721,"ENSMUSG00000046959, ENSMUSG00000032122, ENSMUSG00000036196, ENSMUSG00000023259, ENSMUSG00000001225, ENSMUSG00000029015","Slc26a1, Slc37a2, Slc26a8, Slc26a6, Slc26a3, Slc26a5"
"GO_DNA_SECONDARY_STRUCTURE_BINDING",22,0.0909090909090909,0.318181818181818,"Up",0.204,0.384845454545455,"ENSMUSG00000026048, ENSMUSG00000054717, ENSMUSG00000024151, ENSMUSG00000030254","Ercc5, Hmgb2, Msh2, Rad18"
"GO_RNA_POLYMERASE_II_REPRESSING_TRANSCRIPTION_FACTOR_BINDING",27,0.0740740740740741,0.296296296296296,"Up",0.205,0.384845454545455,"ENSMUSG00000033543, ENSMUSG00000005836, ENSMUSG00000028800, ENSMUSG00000041238, ENSMUSG00000042557, ENSMUSG00000001280, ENSMUSG00000071646","Gtf2a2, Gata6, Hdac1, Rbbp8, Sin3a, Sp1, Mta2"
"GO_FATTY_ACYL_COA_BINDING",31,0.0967741935483871,0.225806451612903,"Up",0.205,0.384845454545455,"ENSMUSG00000062908, ENSMUSG00000021417, ENSMUSG00000030861, ENSMUSG00000032314, ENSMUSG00000026003","Acadm, Eci2, Acadsb, Etfa, Acadl"
"GO_HISTONE_KINASE_ACTIVITY",18,0.166666666666667,0.222222222222222,"Up",0.205,0.384845454545455,"ENSMUSG00000024789, ENSMUSG00000025358, ENSMUSG00000050697, ENSMUSG00000019942","Jak2, Cdk2, Prkaa1, Cdk1"
"GO_SEROTONIN_RECEPTOR_ACTIVITY",13,0.384615384615385,0.0769230769230769,"Down",0.206,0.384845454545455,"ENSMUSG00000050783, ENSMUSG00000039106, ENSMUSG00000049511, ENSMUSG00000028747, ENSMUSG00000008590","Htr1f, Htr5a, Htr1b, Htr6, Htr3b"
"GO_HISTONE_LYSINE_N_METHYLTRANSFERASE_ACTIVITY",33,0.121212121212121,0.181818181818182,"Up",0.206,0.384845454545455,"ENSMUSG00000024560, ENSMUSG00000071350, ENSMUSG00000027684, ENSMUSG00000034639","Cxxc1, Setdb2, Mecom, Setmar"
"GO_ENDONUCLEASE_ACTIVITY",114,0.12280701754386,0.157894736842105,"Up",0.206,0.384845454545455,"ENSMUSG00000022468, ENSMUSG00000026048, ENSMUSG00000034639, ENSMUSG00000060152, ENSMUSG00000019088, ENSMUSG00000024925, ENSMUSG00000021023, ENSMUSG00000024785, ENSMUSG00000041238","Endou, Ercc5, Setmar, Pop5, Dnase1l1, Rnaseh2c, 1110008L16Rik, Rcl1, Rbbp8"
"GO_HORMONE_BINDING",62,0.209677419354839,0.290322580645161,"Up",0.207,0.385938508064516,"ENSMUSG00000057530, ENSMUSG00000022206, ENSMUSG00000055737, ENSMUSG00000027712, ENSMUSG00000061808, ENSMUSG00000053317, ENSMUSG00000025993, ENSMUSG00000027931, ENSMUSG00000039202, ENSMUSG00000026836, ENSMUSG00000005534, ENSMUSG00000026457, ENSMUSG00000024431, ENSMUSG00000005533","Ece1, Npr3, Ghr, Anxa5, Ttr, Sec61b, Slc40a1, Npr1, Abhd2, Acvr1, Insr, Adipor1, Nr3c1, Igf1r"
"GO_RHO_GUANYL_NUCLEOTIDE_EXCHANGE_FACTOR_ACTIVITY",72,0.180555555555556,0.305555555555556,"Up",0.208,0.38625,"ENSMUSG00000021895, ENSMUSG00000052921, ENSMUSG00000002489, ENSMUSG00000033542, ENSMUSG00000025504, ENSMUSG00000029032, ENSMUSG00000024241, ENSMUSG00000020640, ENSMUSG00000031511, ENSMUSG00000039713, ENSMUSG00000048960, ENSMUSG00000034037, ENSMUSG00000021215","Arhgef3, Arhgef15, Tiam1, Arhgef5, Eps8l2, Arhgef16, Sos1, Itsn2, Arhgef7, Plekhg5, Prex2, Fgd5, Net1"
"GO_HYDROLASE_ACTIVITY_ACTING_ON_CARBON_NITROGEN_BUT_NOT_PEPTIDE_BONDS_IN_CYCLIC_AMIDINES",27,0.259259259259259,0.185185185185185,"Down",0.208,0.38625,"ENSMUSG00000005686, ENSMUSG00000052551, ENSMUSG00000026192, ENSMUSG00000040694, ENSMUSG00000005667","Ampd3, Adarb2, Atic, Apobec2, Mthfd2"
"GO_ORGANIC_HYDROXY_COMPOUND_TRANSMEMBRANE_TRANSPORTER_ACTIVITY",57,0.157894736842105,0.263157894736842,"Up",0.209,0.386559,"ENSMUSG00000055368, ENSMUSG00000032902, ENSMUSG00000030235, ENSMUSG00000030236, ENSMUSG00000027896, ENSMUSG00000044367, ENSMUSG00000040938","Slc6a2, Slc16a1, Slco1c1, Slco1b2, Slc16a4, Slc16a13, Slc16a11"
"GO_ATPASE_COUPLED_ION_TRANSMEMBRANE_TRANSPORTER_ACTIVITY",68,0.25,0.147058823529412,"Down",0.209,0.386559,"ENSMUSG00000019302, ENSMUSG00000038094, ENSMUSG00000036622, ENSMUSG00000030302, ENSMUSG00000026463, ENSMUSG00000039347, ENSMUSG00000006567, ENSMUSG00000032842, ENSMUSG00000059412, ENSMUSG00000041329, ENSMUSG00000023088, ENSMUSG00000005553, ENSMUSG00000040907, ENSMUSG00000031376, ENSMUSG00000022822","Atp6v0a1, Atp13a4, Atp13a2, Atp2b2, Atp2b4, Atp6v0e2, Atp7b, Abcc10, Fxyd2, Atp1b2, Abcc1, Atp4a, Atp1a3, Atp2b3, Abcc5"
"GO_ACTININ_BINDING",29,0.206896551724138,0.310344827586207,"Up",0.211,0.388712151394422,"ENSMUSG00000045534, ENSMUSG00000028273, ENSMUSG00000024471, ENSMUSG00000025809, ENSMUSG00000051747, ENSMUSG00000029086","Kcna5, Pdlim5, Myot, Itgb1, Ttn, Prom1"
"GO_BIOACTIVE_LIPID_RECEPTOR_ACTIVITY",14,0.285714285714286,0.285714285714286,"Down",0.211,0.388712151394422,"ENSMUSG00000031861, ENSMUSG00000036832","Lpar2, Lpar3"
"GO_RNA_CAP_BINDING",10,0.1,0.1,"Up",0.213,0.391625248508946,"ENSMUSG00000026254","Eif4e2"
"GO_CALCIUM_DEPENDENT_PROTEIN_BINDING",55,0.254545454545455,0.254545454545455,"Up",0.215,0.393745544554455,"ENSMUSG00000019461, ENSMUSG00000021814, ENSMUSG00000024659, ENSMUSG00000027861, ENSMUSG00000032231, ENSMUSG00000029484, ENSMUSG00000018340, ENSMUSG00000026580, ENSMUSG00000021866, ENSMUSG00000035325, ENSMUSG00000027907, ENSMUSG00000029994","Plscr3, Anxa7, Anxa1, Casq2, Anxa2, Anxa3, Anxa6, Selp, Anxa11, Sec31a, S100a11, Anxa4"
"GO_N_ACYLTRANSFERASE_ACTIVITY",90,0.133333333333333,0.222222222222222,"Up",0.215,0.393745544554455,"ENSMUSG00000027018, ENSMUSG00000037935, ENSMUSG00000091043, ENSMUSG00000037722, ENSMUSG00000035021, ENSMUSG00000002728","Hat1, Smarce1, Glyatl3, Gnpnat1, Baz1a, Naa20"
"GO_SYNTAXIN_BINDING",88,0.340909090909091,0.193181818181818,"Down",0.216,0.394293713163065,"ENSMUSG00000034799, ENSMUSG00000029608, ENSMUSG00000054453, ENSMUSG00000027849, ENSMUSG00000068923, ENSMUSG00000027457, ENSMUSG00000027220, ENSMUSG00000027273, ENSMUSG00000039714, ENSMUSG00000047990, ENSMUSG00000072214, ENSMUSG00000016200, ENSMUSG00000033615, ENSMUSG00000004961, ENSMUSG00000022340, ENSMUSG00000022829, ENSMUSG00000044912, ENSMUSG00000091648, ENSMUSG00000024261, ENSMUSG00000062542, ENSMUSG00000030731, ENSMUSG00000027438, ENSMUSG00000009894, ENSMUSG00000020894, ENSMUSG00000004626, ENSMUSG00000025867","Unc13a, Rph3a, Sytl5, Syt6, Syt11, Snph, Syt13, Snap25, Cplx3, C2cd4a, Sept5, Syt14, Cplx1, Syt5, Sybu, Stxbp5l, Syt16, C2cd4d, Syt4, Syt9, Syt3, Napb, Snap47, Vamp2, Stxbp2, Cplx2"
"GO_CATECHOLAMINE_BINDING",15,0.4,0.0666666666666667,"Down",0.217,0.394293713163065,"ENSMUSG00000045318, ENSMUSG00000032259, ENSMUSG00000031489, ENSMUSG00000035283","Adra2c, Drd2, Adrb3, Adrb1"
"GO_SCAVENGER_RECEPTOR_ACTIVITY",38,0.236842105263158,0.263157894736842,"Up",0.217,0.394293713163065,"ENSMUSG00000035459, ENSMUSG00000058952, ENSMUSG00000038188, ENSMUSG00000034205, ENSMUSG00000019989, ENSMUSG00000022468, ENSMUSG00000025185, ENSMUSG00000028776, ENSMUSG00000017344","Stab2, Cfi, Scarf1, Loxl2, Enpp3, Endou, Loxl4, Tinagl1, Vtn"
"GO_LRR_DOMAIN_BINDING",15,0.2,0.2,"Up",0.217,0.394293713163065,"ENSMUSG00000035873","Pawr"
